Easter VI	Vocem jucunditatis. Isaiah 48:20.	WITH a voice of singing declare ye, tell this, alleluia * utter it even to the end of the earth; say ye, the Lord hath redeemed his people, alleluia, alleluia.	Psalm 66. O be joyful in God, all ye lands, sing praises unto the honour of his Name * make his praise to be glorious.  ✠Glory be &c	O LORD, from whom all good things do come: grant to us thy humble servants; that by thy holy inspiration we may think those things that be good, and by thy merciful guiding may perform the same; through Jesus Christ thy Son our Lord, who liveth and reigneth with thee, in the unity of the Holy Spirit, ever one God, world without end. * Amen.	St John 16.	Alleluia, alleluia. I came forth from the Father, and am come into the world * again, I leave the world, and go to the Father. Alleluia, alleluia.	Psalm 65. O bless the Lord our God, ye peoples, and make the voice of His praise to be heard * who hath set my soul to live, and hath not suffered my feet to be moved. Blessed be the Lord, who hath not turned away my prayer, nor His mercy from me, alleluia. 	WE BESEECH thee, O Lord, to accept the prayers and oblations of thy faithful people: that through this observance of our bounden devotion we may attain to the glory of thy heavenly kingdom. Through &c		Psalm 96.	O SING unto the Lord, alleluia * sing unto the Lord, and praise his Name, be telling of his salvation from day to day. alleluia, alleluia.	Grant to us, O Lord, who are filled with strength from this heavenly Table, that we may both desire what is right, and obtain what we desire. Through our Lord Jesus Christ, Thy Son: Who with Thee liveth and reigneth in the unity of the Holy Ghost, God, world without end. Amen.		35
Ascension of our Lord	Viri Galilaei. Acts 1.	YE MEN of Galilee, why stand ye gazing up into heaven? Alleluia  * in like manner as ye have seen him going up into heaven, so shall he come again. Alleluia, alleluia, alleluia.	Psalm 47. O clap your hands together, all ye people  * O sing unto God with the voice of melody. ✠Glory be &c	Collect not found	St Matthew 28.	Alleluia. Go therefore and make disciples of all nations, baptizing them in the name of the Father and of the Son and of the Holy Spirit, teaching them to observe all that I have commanded you; and lo, I am with you always, to the close of the age.” Alleluia, alleluia.	Psalm 47. God is gone up with a merry noise  * and the Lord with the sound of the trump, alleluia.	ACCEPT. O Lord, we pray thee, the oblations which, in remembrance of the glorious Ascension of thy Son, we do offer unto thee : and mercifully grant that we, being delivered from all perils in this life ;present, may attain in the end unto life everlasting. Through the same.		Psalm 68.	Sing ye to the Lord, who ascended to the heaven of heavens, to the sunrising, alleluia.	GRANT, we beseech thee, Almighty and merciful God : that we which have outwardly received these holy mysteries, may inwardly be made partakers of the benefit of the same. Through &c.		36
Sunday after Ascension	Exaudi, Domine. Psalm  27.	HEARKEN unto my voice, O Lord, when I cry unto thee, alleluia: my heart hath talked of thee, Seek ye my face; thy face, Lord will I seek * O hide not thou thy face from me, alleluia, alleluia.	Psalm ibid. The Lord is my light and my salvation * whom then shall I fear? ✠Glory be &c	O GOD, the King of Glory, who hast exalted thine only Son Jesus Christ with great triumph unto thy kingdom in heaven: we beseech thee, leave us not comfortless; but send to us thy Holy Spirit to comfort us, and exalt us unto the same place whither our Saviour Christ is gone before; who liveth and reigneth with thee, in the unity of the same Holy Spirit, ever one God, world without end. * Amen.	St John 14.	Alleluia, alleluia. I will not leave you comfortless * I go away and come again unto you, and your heart shall rejoice. Alleluia.	Psalm 47. GOD is gone up with a merry noise * and the Lord with the sound of the trump, alleluia.	GRANT, O Lord, that this spotless sacrifice may cleanse us from all our sins: and shed forth within our souls the strength of thy heavenly grace.  Through &c		St John 17.	FATHER, while I was with them in the world, I kept those that thou gavest me, alleluia: and now I come to thee * I pray not that thou shouldest take them out of the world, but that thou shouldest keep them from the evil, alleluia, alleluia.	O LORD, who hast vouchsafed to satisfy us with the sacred gifts of thy bounty: grant, we beseech thee, that we may ever continue to render thanks unto thee for the same. Through &c		37
Whitsunday	Spiritus Domini. Wisdom 1.	THE Spirit of the Lord hath filled the whole world, alleluia  * and that which containeth all things hath knowledge of the voice, alleluia, alleluia, alleluia.	Psalm 68. Let God arise, and let his enemies be scattered  * let them also that hate him flee before him. ✠Glory be &c	O GOD, who as at this time didst teach the hearts of thy faithful people, by sending to them the light of thy Holy Spirit: grant us by the same Spirit to have a right judgment in all things; and evermore to rejoice in his holy comfort; through the merits of Christ Jesus thy Son our Lord, who liveth and reigneth with thee, in the unity of the same Holy Spirit, ever one God, world without end. * Amen.		Alleluia, alleluia. (Here genuflect.) Come, Holy Ghost, and fill the hearts of thy faithful people  * and kindle in them the fire of thy love. Alleluia.	Psalm 68. Stablish the thing, O God, that thou hast wrought in us  * for thy temple's sake at Jerusalem, shall kings bring presents unto thee, alleluia.	SANCTIFY, 0 Lord, we beseech thee, these our oblations : that being enlightened by the beams of thy Holy Spirit, our hearts may be purified from all evil. Through.		Acts 2.	Suddenly there came a sound from heaven as of a rushing mighty wind, and it filled all the house where they were sitting, alleluia  * and they were all filled with the Holy Ghost, and began to speak the wonderful works of God, alleluia, alleluia.	WE humbly beseech thee, O Lord, that thou wouldest send down upon our hearts the healthful Spirit of thy grace : and, that we may bring forth fruit unto thee, pour upon us the inward dew of his blessing. Through &c.	SEQUENCE. COME, thou Holy Spirit, come ; and from thy celestial home send thy light and brilliancy. Come, thou father of the poor, come who givest all our store, come the soul's true radiancy. Come, of comf orters the best, of the soul the sweetest guest, sweetly and refreshingly. Come, in labour rest most sweet, shade and coolness in the heat, comfort in adversity. Thou who art the Light most blest, come fulf il their inmost breast, who believe most faithfully. For without thy Godhead's dower, man hath nothing in his power, save to work iniquity. What is filthy make thou pure, what is wounded work its cure, wate r what is parched and dry. Gently bend the stubborn will, warm to life the heart that's chill, guide who goeth erringly. Fill thy faithful who adore, and confess thee ever more, with thy sevenfold mystery. Here thy grace and virtue send, grant salvation in the end, and in heaven felicity. Amen. Alleluia.	38
Most Holy Trinity	Benedicta sit. Tobit 12.	BLESSED be the holy Trinity, and the undivided Unity * we will confess him, because he hath shewed his mercy upon us.	Psalm 8. O Lord our Governour: how excellent is thy Name in all the world. ✠Glory be &c	ALMIGHTY and everlasting God, who hast given unto us thy servants grace, by the confession of a true faith, to acknowledge the glory of the eternal Trinity, and in the power of the Divine Majesty to worship the Unity: we beseech thee; that this holy faith may evermore be our defence against all adversities; who livest and reignest, ever one God, world without end. * Amen.	Daniel 3.	Alleluia, alleluia. Blessed art thou, O Lord God of our fathers * and to be praised and exalted above all for ever. Alleluia.	Tobit 12. Blessed be God the Father, and the only-begotten Son of God, and likewise the Holy Spirit * for he hath shewed his mercy upon us.	O LORD GOD ALMIGHTY, we humbly beseech thee, that by the power of thy holy Name, thou wouldest vouchsafe to sanctify this oblation of our sacrifice: that we may thereby be enabled evermore to present ourselves unto thee to be an oblation acceptable in thy sight.		Tobit 12.	We bless the God of heaven, and extol him before all the living * for he hath shewed his mercy upon us.	O ETERNAL LORD GOD, who hast given unto us to acknowledge the holy and eternal Trinity to be likewise one undivided Unity: mercifully grant, that we, who have now received thy holy sacraments, may thereby be defended from all adversities which may happen to the body and from all evil thoughts which may assault and hurt the soul.		39
Corpus Christi	Cibavit eos. Psalm 81.	HE FED them also with the finest wheat flour * and with honey from the rock hath he satisfied them.	Psalm ibid. Sing we merrily unto God our helper * make a cheerful noise unto the God of Jacob. ✠Glory be &c	O GOD, who in a wonderful Sacrament hast left unto us a memorial of thy Passion: grant us, we beseech thee, so to venerate the sacred mysteries of thy Body and Blood; that we may ever know within ourselves the fruit of thy redemption; who livest and reignest with the Father, in the unity of the Holy Spirit, ever one God, world without end. * Amen.	John 6.	Alleluia, alleluia. My Flesh is meat indeed, and my Blood is drink indeed * he that eateth my Flesh and drinketh my Blood, dwelleth in me, and I in him. Alleluia.	Leviticus 21. The priests of the Lord do offer the offerings of the Lord made by fire and the Bread of their God * therefore they shall be holy unto their God, and not profane the Name of their God.	WE BESEECH thee, O Lord, that like as we in these our oblations do shew forth in a mystery the unity and concord of thy Church: so thou wouldest ever mercifully bestow upon her these thy blessings. Through.		I Corinthians 11.	As often as ye do eat of this Bread, and drink of this Cup, ye do shew the Lord's death till he come * wherefore, whosoever shall eat of this Bread, and drink of this Cup of the Lord, unworthily, shall be guilty of the Body and Blood of the Lord. Alleluia.	GRANT, we beseech thee, O Lord: that we who in these outward tokens have been made partakers of thy most precious Body and Blood; may after this life be replenished with the fruition of thy glorious Godhead. Who livest and reignest with the Father.	Lauda Sion Salvatorem.  Laud, O Sion, thy Salvation, Laud with hymns of exaltation Christ, thy King and Shepherd true:  Spend thyself, his honour raising, Who surpasseth all thy praising; Never canst thou reach his due.  Sing to-day, the mystery shewing Of the living, life-bestowing Bread from heaven before thee set;  E'en the same of old provided, Where the Twelve, divinely guided, At the holy Table met.  Full and clear ring out thy chanting, Joy nor sweetest grace be wanting To thy heart and soul today;  When we gather up the measure Of that Supper and its treasure, Keeping feast in glad array.  Lo, the new King's Table gracing, This new Passover of blessing Hath fulfilled the elder rite:  Now the new the old effaceth, Truth revealed the shadow chaseth, Day is breaking on the night.  What he did at Supper seated, Christ ordained to be repeated His memorial ne'er to cease:  And, His word for guidance taking, Bread and wine we hallow, making Thus our sacrifice of peace.  This the truth to Christians given - Bread becomes His Flesh from heaven, Wine becomes His Holy Blood.  Doth it pass thy comprehending? Yet by faith, thy sight transcending, Wondrous things are understood.  Yea, beneath these signs are hidden Glorious things to sight forbidden: Look not on the outward sign.  Wine is poured and Bread is broken, But in either sacred token Christ is here by power divine.  Whoso of this Food partaketh, Rendeth not the Lord nor breaketh: Christ is whole to all that taste.  Thousands are, as one, receivers; One as thousands of believers, Takes the Food that cannot waste.  Good and evil men are sharing One repast, a doom preparing Varied as the heart of man;  Doom of life or death awarded, As their days shall be recorded Which from one beginning ran.  When the Sacrament is broken, Doubt not in each severed token, Hallowed by the word once spoken, Resteth all the true content:  Nought the precious Gift divideth, Breaking but the sign betideth, He himself the same abideth, Nothing of His fulness spent.  Lo! the Angel's Food is given To the pilgrim who hath striven; See the children's Bread from heaven, Which to dogs may not be cast;  Truth the ancient types fulfilling; Isaac bound, a victim willing; Paschal lamb, its life-blood spilling; Manna sent in ages past.  O true Bread, good Shepherd, tend us, Jesu of thy love befriend us, Thou refresh us, thou defend us, Thine eternal goodness send us In the land of life to see;  Thou who all things canst and knowest, Who on earth such Food bestowest, Grant us with thy Saints though lowest, Where the heavenly Feast thou shewest, Fellow-heirs and guests to be.  Amen. Alleluia. 	38
Trinity I	Domine, in tua misericordia. Psalm  13.	O LORD, my trust in thy mercy: and my heart is joyful in thy salvation * I will sing of the Lord, because he hath dealt so lovingly with me.	Psalm ibid. How long wilt thou forget me, O Lord, for ever? How long wilt thou hide thy face from me? ✠Glory be &c	O GOD, the strength of all them that put their trust in thee: mercifully accept our prayers; and because through the weakness of our mortal nature we can do no good thing without thee, grant us the help of thy grace, that in keeping thy commandments we may please thee both in will and deed; through Jesus Christ thy Son our Lord, who liveth and reigneth with thee, in the unity of the Holy Spirit, ever one God, world without end. * Amen.	Psalm 5.	Alleluia, alleluia. Ponder my words, O Lord * consider my meditation. Alleluia.	Psalm 5. O hearken thou unto the voice of my calling, my King and my God * for unto thee, O Lord, will I make my prayer.	WE BESEECH thee, O Lord, graciously to accept this our sacrifice which we offer unto thee: that the same may effectually avail for our succour unto everlasting life. Through.		Psalm 9.	I will speak of all thy marvellous works: I will be glad and rejoice in thee * yea, my songs will I make of thy Name, O thou Most Highest.	O LORD, who hast vouchsafed to fulfil us with thy wondrous bounty: grant, we beseech thee, that we receiving these gifts of our redemption may never cease from shewing forth thy praises. Through &c.		39
Trinity II	Factus est Dominus. Psalm  18.	THE LORD was my upholder, he brought me forth also into a place of liberty * he brought me forth, even because he had a favour unto me.	Psalm Ibid. I will love thee, O Lord, my strength * the Lord is my stony rock, my defence, and my Saviour. ✠Glory be &c	O LORD, who never failest to help and govern them whom thou dost bring up in thy steadfast fear and love: keep us, we beseech thee, under the protection of thy good providence; and make us to have a perpetual fear and love of thy holy Name; through Jesus Christ thy Son our Lord, who liveth and reigneth with thee, in the unity of the Holy Spirit, ever one God, world without end. * Amen.	Psalm 7.	Alleluia, alleluia. O Lord my God, in thee have I put my trust * save me from all them that persecute me, and deliver me. Alleluia.	Psalm 6. Turn thee, O Lord, and deliver my soul * O save me for thy mercy's sake.	GRANT, O Lord, that the oblation which we consecrate unto thy Name may cleanse us from all our sins: and daily renew us to the attainment of heavenly life.  Through &c		Psalm 13.	I will sing of the Lord, because he hath dealt so lovingly with me * yea, I will praise the Name of the Lord Most Highest.	O LORD, who hast here vouchsafed unto us to be partakers of thy bounty: grant, we beseech thee, that we may so continue to draw near unto the same, that, growing more and more in grace, we may attain in the end to everlasting life. Through &c.		40
Trinity III	Respice in me. Psalm  25.	TURN thee unto me, and have mercy upon me, O Lord : for I am desolate, and in misery: look upon my adversity and misery * and forgive me all my sin, O my God.	Psalm ibid. Unto thee, O Lord, will I lift up my soul * my God, I have put my trust in thee, O let me not be confounded. ✠Glory be &c	O LORD, we beseech thee mercifully to hear us: and grant that we, to whom thou hast given an hearty desire to pray; may, by thy mighty aid, be defended and comforted in all dangers and adversities; through Jesus Christ thy Son our Lord, who liveth and reigneth with thee, in the unity of the Holy Spirit, ever one God, world without end.  * Amen.	Psalm 7.	Alleluia, alleluia. God is a righteous judge, strong and patient * and God is provoked every day. Alleluia.	Psalm 9. They that know thy Name will put their trust in thee: for thou, Lord, hast never failed them that seek thee: O Praise the Lord, which dwelleth in Sion * for he forgetteth not the complain of the poor.	SANCTIFY, O Lord, we beseech thee, the oblations which we offer unto thee: and mercifully grant that they may be made unto us the Body and Blood of thine only begotten Son. Who liveth and reigneth with thee.		St Luke 15.	I say unto you * There is joy in the presence of the Angels of God over one sinner that repenteth.	WE BESEECH thee, O Lord, that we which have received these holy mysteries: may be their power be cleansed from all our iniquities; and evermore be filled with the bounteous gifts of thy grace. Through &c.		41
Trinity IV	Dominus illuminatio mea. Psalm  27.	THE LORD is my light, and my salvation, whom then shall I fear? The LORD is the strength of my life, of whom then shall I be afraid? When mine enemies came upon me, they stumbled and fell.	Psalm ibid. Though an host of men were laid against me * yet shall not my heart be afraid. ✠Glory be &c	O GOD, the protector of all that trust in thee, without whom nothing is strong, nothing is holy: increase and multiply upon us thy mercy; that, thou being our ruler and guide, we may so pass through things temporal, that we finally lose not the things eternal: grant this, O heavenly Father, for the sake of Jesus Christ our Lord, who liveth and reigneth with thee, in the unity of the Holy Spirit, ever one God, world without end. * Amen.	Psalm 9.	Alleluia, alleluia. Thou O God, are set in the throne that judgest right * be thou the refuge of the opprest in due time of trouble. Alleluia.	Psalm 13. Lighten mine eyes, that I sleep not in death : lest mine enemy say * I have prevailed against him.	REGARD, O Lord, we pray thee, the prayers and oblations of thy Church: and grant that they may ever be profitable for the salvation and sanctification of us thy faithful people, through &c		Psalm 18.	The Lord is my stony rock, and my defence * my Saviour, my god, and my might.	WE PRAY thee, O Lord, that we being quickened by these mysteries which we have received: may thereby be cleansed from all our sins; and made ready for the obtaining of thy everlasting mercy. Through &c.		42
Trinity V	Exaudi, Domine. Psalm  27.	HEARKEN unto my voice, O Lord, when I cry unto thee * thou hast been my succour, leave me not, neither forsake me, O God of my salvation.	Psalm ibid. The Lord is my light, and my salvation * whom then shall I fear? ✠Glory be &c	GRANT, O Lord, we beseech thee: that the course of this world may be so peaceably ordered by thy governance; that thy Church may joyfully serve thee in all godly quietness; through Jesus Christ thy Son our Lord, who liveth and reigneth with thee, in the unity of the Holy Spirit, ever one God, world without end. * Amen.	Psalm 20.	Alleluia, alleluia. The king shall rejoice in thy strength, O Lord * exceeding glad shall he be of thy salvation. Alleluia.	Psalm 16. I will thank the Lord for giving me warning: I have set God always before me * for he is on my right hand, therefore I shall not fall.	MOST merciful Lord, we beseech thee, to have respect unto these our oblations : that whereas we have rebelled and done evil against thee, we may by thy grace be conformed unto thy will, through &c		Psalm 27.	One thing have I desired of the Lord, which I will require * even that I may dwell in the house of the Lord all the days of my life.	WE BESEECH thee, O Lord, that the mysteries which we have received: may cleanse us from all our sins; and defend us by thy gifts bestowed therein from all adversities. Through &c.		43
Trinity VI	Dominus fortitudo. Psalm  28.	THE Lord is the strength of his people, and he is the wholesome defence of his Anointed: O Lord, save thy people, and give thy blessing unto thine inheritance * feed them, and set them up for ever.	Psalm ibid. Unto thee will I cry, O Lord, my God, think no scorn of me * lest, if thou make as though thou hearest not, I become like unto them that go down into the pit. ✠Glory be &c	O GOD, who hast prepared for them that love thee such good things as pass man’s understanding: pour into our hearts such love toward thee; that we, loving thee in all things and above all things, may obtain thy promises, which exceed all that we can desire; through Jesus Christ thy Son our Lord, who liveth and reigneth with thee, in the unity of the Holy Spirit, ever one God, world without end. * Amen.	Psalm 31.	Alleluia, alleluia. In thee, O Lord, have I put my trust, let me never be put to confusion: deliver me in thy righteousness * bow down thine ear to me, make haste to deliver me. Alleluia.	Psalm 17. To hold thou up my goings in thy paths, that my footsteps slip not: incline thine ear to me, and hearken unto my words * shew thy marvellous loving-kindness, O Lord, thou that art the Saviour of them which put their trust in thee.	WE beseech thee, O Lord, to have compassion on our prayers: and graciously to accept the oblations of thy servants and handmaidens; that those things which each hath offered to the honour of thy Name may be profitable unto all for their salvation.  Through &c		Psalm 27.	I will offer in his dwelling an oblation with great gladness * I will sing, and speak praises unto the Lord.	O LORD, who hast satisfied us withy thy heavenly bounties: grant that we may be cleansed from all our secret faults, and delivered from all the crafts and assaults of our enemies. Through &c.		44
Trinity VII	Omnes gentes. Psalm  47.	O CLAP your hands together, all ye people * O sing unto God with the voice of melody.	Psalm ibid. For the Lord is high and to be feared * he is the great king upon all the earth. ✠Glory be &c	LORD of all power and might, who art the author and giver of all good things: graft in our hearts the love of thy Name; increase in us true religion, nourish us with all goodness, and of thy great mercy keep us in the same; through Jesus Christ thy Son our Lord, who liveth and reigneth with thee, in the unity of the Holy Spirit, ever one God, world without end. * Amen.	Psalm 47.	Alleluia, alleluia. O clap your hands together, all ye people * sing unto God with the voice of melody. Alleluia	Psalm 18. Thou shalt save the people that are in adversity, O Lord, and shalt bring down the high looks of the proud * for who is God, but the Lord?	WE BESEECH thee, O Lord, to have compassion on our prayers, and graciously to accept the oblations of thy faithful people: and to the intent that none may ask amiss or fail in his petitions, grant, we beseech thee, that what we ask faithfully, we may obtain effectually.  Through &c		Psalm 31.	Bow down thine ear * make haste to deliver us.	O LORD, who hast vouchsafed to satisfy us with these thy gifts: grant, we beseech thee; that the same may ever cleanse us by their operation, and defend us by their succour. Through &c.		45
Trinity VIII	Suscepimus. Psalm  48.	WE have waited for thy loving-kindness, O God, in the midst of thy temple: O God, according to thy Name, so is thy praise unto the world's end * thy right hand is full of righteousness.	Psalm ibid. Great is the Lord, and highly to be praised * in the city of our God, even upon his holy hill. ✠Glory be &c	O GOD, whose never-failing providence ordereth all things both in heaven and earth: we humbly beseech thee to put away from us all hurtful things; and to give us those things which be profitable for us; through Jesus Christ thy Son our Lord, who liveth and reigneth with thee, in the unity of the Holy Spirit, ever one God, world without end.  * Amen.	Psalm 48.	Alleluia, alleluia. Great is the Lord, and highly to be praised * in the city of our God, even upon his holy hill. Alleluia.	Psalm 18. Thou shalt save the people that are in adversity, O Lord, and shalt bring down the high looks of the proud * for who is God, but the Lord?	O GOD, who didst ratify the manifold sacrifices of the law by the one perfect sacrifice of our redemption: mercifully accept the oblation of thy bounden servants, and sanctify them with that benediction wherewith thou didst bless the gifts of Abel thy servant; that what each hath offered to the honour of thy majesty may be profitable unto all for their salvation. Through.		Psalm 34.	O taste and see how gracious the Lord is * blessed is he that putteth his trust in him.	GRANT, O Lord, that the power of thy healing may mercifully cleanse us from all our perversities: and lead us henceforth in the paths of righteousness. Through &c.		46
