Psalm73.14	14 Yea, and I had almost said even as they * but lo, then I should have condemned the generation of thy children.	Yea, and I had almost said even as they * but lo, then I should have condemned the generation of thy children.	73014	1208
Psalm73.15	15 Then thought I to understand this * but it was too hard for me,	Then thought I to understand this * but it was too hard for me,	73015	1209
Psalm73.16	16 Until I went into the sanctuary of God * then understood I the end of these men;	Until I went into the sanctuary of God * then understood I the end of these men;	73016	1210
Psalm73.17	17 Namely, how thou dost set them in slippery places * and castest them down, and destroyest them.	Namely, how thou dost set them in slippery places * and castest them down, and destroyest them.	73017	1211
Psalm73.18	18 O how suddenly do they consume * perish, and come to a fearful end!	O how suddenly do they consume * perish, and come to a fearful end!	73018	1212
Psalm73.19	19 Yea, even like as a dream when one awaketh * so shalt thou make their image to vanish out of the city.	Yea, even like as a dream when one awaketh * so shalt thou make their image to vanish out of the city.	73019	1213
Psalm73.20	20 Thus my heart was grieved * and it went even through my reins.	Thus my heart was grieved * and it went even through my reins.	73020	1214
Psalm73.21	21 So foolish was I, and ignorant * even as it were a beast before thee.	So foolish was I, and ignorant * even as it were a beast before thee.	73021	1215
Psalm73.22	22 Nevertheless, I am alway by thee * for thou hast holden me by my right hand.	Nevertheless, I am alway by thee * for thou hast holden me by my right hand.	73022	1216
Psalm73.23	23 Thou shalt guide me with thy counsel * and after that receive me with glory.	Thou shalt guide me with thy counsel * and after that receive me with glory.	73023	1217
Psalm73.24	24 Whom have I in heaven but thee * and there is none upon earth that I desire in comparison of thee.	Whom have I in heaven but thee * and there is none upon earth that I desire in comparison of thee.	73024	1218
Psalm73.25	25 My flesh and my heart faileth * but God is the strength of my heart, and my portion for ever.	My flesh and my heart faileth * but God is the strength of my heart, and my portion for ever.	73025	1219
Psalm73.26	26 For lo, they that forsake thee shall perish * thou hast destroyed all them that commit fornication against thee.	For lo, they that forsake thee shall perish * thou hast destroyed all them that commit fornication against thee.	73026	1220
Psalm73.27	27 But it is good for me to hold me fast by God, to put my trust in the Lord God * and to speak of all thy works in the gates of the daughter of Sion.	But it is good for me to hold me fast by God, to put my trust in the Lord God * and to speak of all thy works in the gates of the daughter of Sion.	73027	1221
Psalm74.0	Psalm 74. Ut quid, Deus?	Psalm 74. Ut quid, Deus?	74000	1222
Psalm74.1	1 O GOD, wherefore art thou absent from us so long * why is thy wrath so hot against the sheep of thy pasture?	O GOD, wherefore art thou absent from us so long * why is thy wrath so hot against the sheep of thy pasture?	74001	1223
Psalm74.2	2 O think upon thy congregation * whom thou hast purchased and redeemed of old.	O think upon thy congregation * whom thou hast purchased and redeemed of old.	74002	1224
Psalm74.3	3 Think upon the tribe of thine inheritance * and mount Sion, wherein thou hast dwelt.	Think upon the tribe of thine inheritance * and mount Sion, wherein thou hast dwelt.	74003	1225
Psalm74.4	4 Lift up thy feet, that thou mayest utterly destroy every enemy * which hath done evil in thy sanctuary.	Lift up thy feet, that thou mayest utterly destroy every enemy * which hath done evil in thy sanctuary.	74004	1226
Psalm74.5	5 Thine adversaries roar in the midst of thy congregations * and set up their banners for tokens.	Thine adversaries roar in the midst of thy congregations * and set up their banners for tokens.	74005	1227
Psalm74.6	6 He that hewed timber afore out of the thick trees * was known to bring it to an excellent work.	He that hewed timber afore out of the thick trees * was known to bring it to an excellent work.	74006	1228
Psalm74.7	7 But now they break down all the carved work thereof * with axes and hammers.	But now they break down all the carved work thereof * with axes and hammers.	74007	1229
Psalm74.8	8 They have set fire upon thy holy places * and have defiled the dwelling-place of thy Name, even unto the ground.	They have set fire upon thy holy places * and have defiled the dwelling-place of thy Name, even unto the ground.	74008	1230
Psalm74.9	9 Yea, they said in their hearts, Let us make havock of them altogether * thus have they burnt up all the houses of God in the land.	Yea, they said in their hearts, Let us make havock of them altogether * thus have they burnt up all the houses of God in the land.	74009	1231
Psalm74.10	10 We see not our tokens, there is not one prophet more * no, not one is there among us, that understandeth any more.	We see not our tokens, there is not one prophet more * no, not one is there among us, that understandeth any more.	74010	1232
Psalm74.11	11 O God, how long shall the adversary do this dishonour * how long shall the enemy blaspheme thy Name, for ever?	O God, how long shall the adversary do this dishonour * how long shall the enemy blaspheme thy Name, for ever?	74011	1233
Psalm74.12	12 Why withdrawest thou thy hand * why pluckest thou not thy right hand out of thy bosom to consume the enemy?	Why withdrawest thou thy hand * why pluckest thou not thy right hand out of thy bosom to consume the enemy?	74012	1234
Psalm74.13	13 For God is my King of old * the help that is done upon earth he doeth it himself.	For God is my King of old * the help that is done upon earth he doeth it himself.	74013	1235
Psalm74.14	14 Thou didst divide the sea through thy power * thou brakest the heads of the dragons in the waters.	Thou didst divide the sea through thy power * thou brakest the heads of the dragons in the waters.	74014	1236
Psalm74.15	15 Thou smotest the heads of Leviathan in pieces * and gavest him to be meat for the people in the wilderness.	Thou smotest the heads of Leviathan in pieces * and gavest him to be meat for the people in the wilderness.	74015	1237
Psalm74.16	16 Thou broughtest out fountains and waters out of the hard rocks * thou driedst up mighty waters.	Thou broughtest out fountains and waters out of the hard rocks * thou driedst up mighty waters.	74016	1238
Psalm74.17	17 The day is thine, and the night is thine * thou hast prepared the light and the sun.	The day is thine, and the night is thine * thou hast prepared the light and the sun.	74017	1239
Psalm74.18	18 Thou hast set all the borders of the earth * thou hast made summer and winter.	Thou hast set all the borders of the earth * thou hast made summer and winter.	74018	1240
Psalm74.19	19 Remember this, O Lord, how the enemy hath rebuked * and how the foolish people hath blasphemed thy Name.	Remember this, O Lord, how the enemy hath rebuked * and how the foolish people hath blasphemed thy Name.	74019	1241
Psalm74.20	20 O deliver not the soul of thy turtle-dove unto the multitude of the enemies * and forget not the congregation of the poor for ever.	O deliver not the soul of thy turtle-dove unto the multitude of the enemies * and forget not the congregation of the poor for ever.	74020	1242
Psalm74.21	21 Look upon the covenant * for all the earth is full of darkness and cruel habitations.	Look upon the covenant * for all the earth is full of darkness and cruel habitations.	74021	1243
Psalm74.22	22 O let not the simple go away ashamed * but let the poor and needy give praise unto thy Name.	O let not the simple go away ashamed * but let the poor and needy give praise unto thy Name.	74022	1244
Psalm74.23	23 Arise, O God, maintain thine own cause * remember how the foolish man blasphemeth thee daily.	Arise, O God, maintain thine own cause * remember how the foolish man blasphemeth thee daily.	74023	1245
Psalm74.24	24 Forget not the voice of thine enemies * the presumption of them that hate thee increaseth ever more and more.	Forget not the voice of thine enemies * the presumption of them that hate thee increaseth ever more and more.	74024	1246
Psalm75.0	Psalm 75. Confitebimur tibi.	Psalm 75. Confitebimur tibi.	75000	1247
Psalm75.1	1 UNTO thee, O God, do we give thanks * yea, unto thee do we give thanks.	UNTO thee, O God, do we give thanks * yea, unto thee do we give thanks.	75001	1248
Psalm75.2	2 Thy Name also is so nigh * and that do thy wondrous works declare.	Thy Name also is so nigh * and that do thy wondrous works declare.	75002	1249
Psalm75.3	3 When I receive the congregation * I shall judge according unto right.	When I receive the congregation * I shall judge according unto right.	75003	1250
Psalm75.4	4 The earth is weak, and all the inhabiters thereof * I bear up the pillars of it.	The earth is weak, and all the inhabiters thereof * I bear up the pillars of it.	75004	1251
Psalm75.5	5 I said unto the fools, Deal not so madly * and to the ungodly, Set not up your horn.	I said unto the fools, Deal not so madly * and to the ungodly, Set not up your horn.	75005	1252
Psalm75.6	6 Set not up your horn on high * and speak not with a stiff neck.	Set not up your horn on high * and speak not with a stiff neck.	75006	1253
Psalm75.7	7 For promotion cometh neither from the east, nor from the west * nor yet from the south.	For promotion cometh neither from the east, nor from the west * nor yet from the south.	75007	1254
Psalm75.8	8 And why? God is the Judge * he putteth down one, and setteth up another.	And why? God is the Judge * he putteth down one, and setteth up another.	75008	1255
Psalm75.9	9 For in the hand of the Lord there is a cup, and the wine is red * it is full mixed, and he poureth out of the same.	For in the hand of the Lord there is a cup, and the wine is red * it is full mixed, and he poureth out of the same.	75009	1256
Psalm75.10	10 As for the dregs thereof * all the ungodly of the earth shall drink them, and suck them out.	As for the dregs thereof * all the ungodly of the earth shall drink them, and suck them out.	75010	1257
Psalm75.11	11 But I will talk of the God of Jacob * and praise him for ever.	But I will talk of the God of Jacob * and praise him for ever.	75011	1258
Psalm75.12	12 All the horns of the ungodly also will I break * and the horns of the righteous shall be exalted.	All the horns of the ungodly also will I break * and the horns of the righteous shall be exalted.	75012	1259
Psalm76.0	Psalm 76. Notus in Judaea.	Psalm 76. Notus in Judaea.	76000	1260
Psalm76.1	1 IN JEWRY is God known * his Name is great in Israel.	IN JEWRY is God known * his Name is great in Israel.	76001	1261
Psalm76.2	2 At Salem is his tabernacle * and his dwelling in Sion.	At Salem is his tabernacle * and his dwelling in Sion.	76002	1262
Psalm76.3	3 There brake he the arrows of the bow * the shield, the sword, and the battle.	There brake he the arrows of the bow * the shield, the sword, and the battle.	76003	1263
Psalm76.4	4 Thou art of more honour and might * than the hills of the robbers.	Thou art of more honour and might * than the hills of the robbers.	76004	1264
Psalm76.5	5 The proud are robbed, they have slept their sleep * and all the men whose hands were mighty have found nothing.	The proud are robbed, they have slept their sleep * and all the men whose hands were mighty have found nothing.	76005	1265
Psalm76.6	6 At thy rebuke, O God of Jacob * both the chariot and horse are fallen.	At thy rebuke, O God of Jacob * both the chariot and horse are fallen.	76006	1266
Psalm76.7	7 Thou, even thou art to be feared * and who may stand in thy sight when thou art angry?	Thou, even thou art to be feared * and who may stand in thy sight when thou art angry?	76007	1267
Psalm76.8	8 Thou didst cause thy judgement to be heard from heaven * the earth trembled, and was still;	Thou didst cause thy judgement to be heard from heaven * the earth trembled, and was still;	76008	1268
Psalm76.9	9 When God arose to judgement * and to help all the meek upon earth.	When God arose to judgement * and to help all the meek upon earth.	76009	1269
Psalm76.10	10 The fierceness of man shall turn to thy praise * and the fierceness of them shalt thou refrain.	The fierceness of man shall turn to thy praise * and the fierceness of them shalt thou refrain.	76010	1270
Psalm76.11	11 Promise unto the Lord your God, and keep it, all ye that are round about him * bring presents unto him that ought to be feared.	Promise unto the Lord your God, and keep it, all ye that are round about him * bring presents unto him that ought to be feared.	76011	1271
Psalm76.12	12 He shall refrain the spirit of princes * and is wonderful among the kings of the earth.	He shall refrain the spirit of princes * and is wonderful among the kings of the earth.	76012	1272
Psalm77.0	Psalm 77. Voce mea ad Dominum.	Psalm 77. Voce mea ad Dominum.	77000	1273
Psalm77.1	1 I WILL cry unto God with my voice * even unto God will I cry with my voice, and he shall hearken unto me.	I WILL cry unto God with my voice * even unto God will I cry with my voice, and he shall hearken unto me.	77001	1274
Psalm77.2	2 In the time of my trouble I sought the Lord * my sore ran and ceased not in the night-season ; my soul refused comfort.	In the time of my trouble I sought the Lord * my sore ran and ceased not in the night-season ; my soul refused comfort.	77002	1275
Psalm77.3	3 When I am in heaviness, I will think upon God * when my heart is vexed, I will complain.	When I am in heaviness, I will think upon God * when my heart is vexed, I will complain.	77003	1276
Psalm77.4	4 Thou holdest mine eyes waking * I am so feeble, that I cannot speak.	Thou holdest mine eyes waking * I am so feeble, that I cannot speak.	77004	1277
Psalm77.5	5 I have considered the days of old * and the years that are past.	I have considered the days of old * and the years that are past.	77005	1278
Psalm77.6	6 I call to remembrance my song * and in the night I commune with mine own heart, and search out my spirits.	I call to remembrance my song * and in the night I commune with mine own heart, and search out my spirits.	77006	1279
Psalm77.7	7 Will the Lord absent himself for ever * and will he be no more intreated?	Will the Lord absent himself for ever * and will he be no more intreated?	77007	1280
Psalm77.8	8 Is his mercy clean gone for ever * and is his promise come utterly to an end for evermore?	Is his mercy clean gone for ever * and is his promise come utterly to an end for evermore?	77008	1281
Psalm77.9	9 Hath God forgotten to be gracious * and will he shut up his loving-kindness in displeasure?	Hath God forgotten to be gracious * and will he shut up his loving-kindness in displeasure?	77009	1282
Psalm77.10	10 And I said, It is mine own infirmity * but I will remember the years of the right hand of the most Highest.	And I said, It is mine own infirmity * but I will remember the years of the right hand of the most Highest.	77010	1283
Psalm77.11	11 I will remember the works of the Lord * and call to mind thy wonders of old time.	I will remember the works of the Lord * and call to mind thy wonders of old time.	77011	1284
Psalm77.12	12 I will think also of all thy works * and my talking shall be of thy doings.	I will think also of all thy works * and my talking shall be of thy doings.	77012	1285
Psalm77.13	13 Thy way, O God, is holy * who is so great a God as our God?	Thy way, O God, is holy * who is so great a God as our God?	77013	1286
Psalm77.14	14 Thou art the God that doeth wonders * and hast declared thy power among the people.	Thou art the God that doeth wonders * and hast declared thy power among the people.	77014	1287
Psalm77.15	15 Thou hast mightily delivered thy people * even the sons of Jacob and Joseph.	Thou hast mightily delivered thy people * even the sons of Jacob and Joseph.	77015	1288
Psalm77.16	16 The waters saw thee, O God, the waters saw thee, and were afraid * the depths also were troubled.	The waters saw thee, O God, the waters saw thee, and were afraid * the depths also were troubled.	77016	1289
Psalm77.17	17 The clouds poured out water, the air thundered * and thine arrows went abroad.	The clouds poured out water, the air thundered * and thine arrows went abroad.	77017	1290
Psalm77.18	18 The voice of thy thunder was heard round about * the lightnings shone upon the ground * the earth was moved, and shook withal.	The voice of thy thunder was heard round about * the lightnings shone upon the ground * the earth was moved, and shook withal.	77018	1291
Psalm77.19	19 Thy way is in the sea, and thy paths in the great waters * and thy footsteps are not known.	Thy way is in the sea, and thy paths in the great waters * and thy footsteps are not known.	77019	1292
Psalm77.20	20 Thou leddest thy people like sheep * by the hand of Moses and Aaron.	Thou leddest thy people like sheep * by the hand of Moses and Aaron.	77020	1293
Psalm78.0	Psalm 78. Attendite, popule.	Psalm 78. Attendite, popule.	78000	1294
Psalm78.1	1 HEAR my law, O my people * incline your ears unto the words of my mouth.	HEAR my law, O my people * incline your ears unto the words of my mouth.	78001	1295
Psalm78.2	2 I will open my mouth in a parable * I will declare hard sentences of old;	I will open my mouth in a parable * I will declare hard sentences of old;	78002	1296
Psalm78.3	3 Which we have heard and known * and such as our fathers have told us;	Which we have heard and known * and such as our fathers have told us;	78003	1297
Psalm78.4	4 That we should not hide them from the children of the generations to come * but to shew the honour of the Lord, his mighty and wonderful works that he hath done.	That we should not hide them from the children of the generations to come * but to shew the honour of the Lord, his mighty and wonderful works that he hath done.	78004	1298
Psalm78.5	5 He made a covenant with Jacob, and gave Israel a law * which he commanded our forefathers to teach their children;	He made a covenant with Jacob, and gave Israel a law * which he commanded our forefathers to teach their children;	78005	1299
Psalm78.6	6 That their posterity might know it * and the children which were yet unborn;	That their posterity might know it * and the children which were yet unborn;	78006	1300
Psalm78.7	7 To the intent that when they came up * they might shew their children the same;	To the intent that when they came up * they might shew their children the same;	78007	1301
Psalm78.8	8 That they might put their trust in God * and not to forget the works of God, but to keep his commandments;	That they might put their trust in God * and not to forget the works of God, but to keep his commandments;	78008	1302
Psalm78.9	9 And not to be as their forefathers, a faithless and stubborn generation * a generation that set not their heart aright, and whose spirit cleaveth not stedfastly unto God;	And not to be as their forefathers, a faithless and stubborn generation * a generation that set not their heart aright, and whose spirit cleaveth not stedfastly unto God;	78009	1303
Psalm78.10	10 Like as the children of Ephraim * who being harnessed, and carrying bows, turned themselves back in the day of battle.	Like as the children of Ephraim * who being harnessed, and carrying bows, turned themselves back in the day of battle.	78010	1304
Psalm78.11	11 They kept not the covenant of God * and would not walk in his law;	They kept not the covenant of God * and would not walk in his law;	78011	1305
Psalm78.12	12 But forgat what he had done * and the wonderful works that he had shewed for them.	But forgat what he had done * and the wonderful works that he had shewed for them.	78012	1306
Psalm78.13	13 Marvellous things did he in the sight of our forefathers, in the land of Egypt * even in the field of Zoan.	Marvellous things did he in the sight of our forefathers, in the land of Egypt * even in the field of Zoan.	78013	1307
Psalm78.14	14 He divided the sea, and let them go through * he made the waters to stand on an heap.	He divided the sea, and let them go through * he made the waters to stand on an heap.	78014	1308
Psalm78.15	15 In the day-time also he led them with a cloud * and all the night through with a light of fire.	In the day-time also he led them with a cloud * and all the night through with a light of fire.	78015	1309
Psalm78.16	16 He clave the hard rocks in the wilderness * and gave them drink thereof, as it had been out of the great depth.	He clave the hard rocks in the wilderness * and gave them drink thereof, as it had been out of the great depth.	78016	1310
Psalm78.17	17 He brought waters out of the stony rock * so that it gushed out like the rivers.	He brought waters out of the stony rock * so that it gushed out like the rivers.	78017	1311
Psalm78.18	18 Yet for all this they sinned more against him * and provoked the most Highest in the wilderness.	Yet for all this they sinned more against him * and provoked the most Highest in the wilderness.	78018	1312
Psalm78.19	19 They tempted God in their hearts * and required meat for their lust.	They tempted God in their hearts * and required meat for their lust.	78019	1313
Psalm78.20	20 They spake against God also, saying * Shall God prepare a table in the wilderness?	They spake against God also, saying * Shall God prepare a table in the wilderness?	78020	1314
Psalm78.21	21 He smote the stony rock indeed, that the waters gushed out, and the streams flowed withal * but can he give bread also, or provide flesh for his people?	He smote the stony rock indeed, that the waters gushed out, and the streams flowed withal * but can he give bread also, or provide flesh for his people?	78021	1315
Psalm78.22	22 When the Lord heard this, he was wroth * so the fire was kindled in Jacob, and there came up heavy displeasure against Israel;	When the Lord heard this, he was wroth * so the fire was kindled in Jacob, and there came up heavy displeasure against Israel;	78022	1316
Psalm78.23	23 Because they believed not in God * and put not their trust in his help.	Because they believed not in God * and put not their trust in his help.	78023	1317
Psalm78.24	24 So he commanded the clouds above * and opened the doors of heaven.	So he commanded the clouds above * and opened the doors of heaven.	78024	1318
Psalm78.25	25 He rained down manna also upon them for to eat * and gave them food from heaven.	He rained down manna also upon them for to eat * and gave them food from heaven.	78025	1319
Psalm78.26	26 So man did eat angels' food * for he sent them meat enough.	So man did eat angels' food * for he sent them meat enough.	78026	1320
Psalm78.27	27 He caused the east-wind to blow under heaven * and through his power he brought in the south-west-wind.	He caused the east-wind to blow under heaven * and through his power he brought in the south-west-wind.	78027	1321
Psalm78.28	28 He rained flesh upon them as thick as dust * and feathered fowls like as the sand of the sea.	He rained flesh upon them as thick as dust * and feathered fowls like as the sand of the sea.	78028	1322
Psalm78.29	29 He let it fall among their tents * even round about their habitation.	He let it fall among their tents * even round about their habitation.	78029	1323
Psalm78.30	30 So they did eat and were well filled, for he gave them their own desire * they were not disappointed of their lust.	So they did eat and were well filled, for he gave them their own desire * they were not disappointed of their lust.	78030	1324
Psalm78.31	31 But while the meat was yet in their mouths, the heavy wrath of God came upon them, and slew the wealthiest of them * yea, and smote down the chosen men that were in Israel.	But while the meat was yet in their mouths, the heavy wrath of God came upon them, and slew the wealthiest of them * yea, and smote down the chosen men that were in Israel.	78031	1325
Psalm78.32	32 But for all this they sinned yet more * and believed not his wondrous works.	But for all this they sinned yet more * and believed not his wondrous works.	78032	1326
Psalm78.33	33 Therefore their days did he consume in vanity * and their years in trouble.	Therefore their days did he consume in vanity * and their years in trouble.	78033	1327
Psalm78.34	34 When he slew them, they sought him * and turned them early, and inquired after God.	When he slew them, they sought him * and turned them early, and inquired after God.	78034	1328
Psalm78.35	35 And they remembered that God was their strength * and that the high God was their redeemer.	And they remembered that God was their strength * and that the high God was their redeemer.	78035	1329
Psalm78.36	36 Nevertheless, they did but flatter him with their mouth * and dissembled with him in their tongue.	Nevertheless, they did but flatter him with their mouth * and dissembled with him in their tongue.	78036	1330
Psalm78.37	37 For their heart was not whole with him * neither continued they stedfast in his covenant.	For their heart was not whole with him * neither continued they stedfast in his covenant.	78037	1331
Psalm78.38	38 But he was so merciful, that he forgave their misdeeds * and destroyed them not.	But he was so merciful, that he forgave their misdeeds * and destroyed them not.	78038	1332
Psalm78.39	39 Yea, many a time turned he his wrath away * and would not suffer his whole displeasure to arise.	Yea, many a time turned he his wrath away * and would not suffer his whole displeasure to arise.	78039	1333
Psalm78.40	40 For he considered that they were but flesh * and that they were even a wind that passeth away, and cometh not again.	For he considered that they were but flesh * and that they were even a wind that passeth away, and cometh not again.	78040	1334
