Psalm108.13	13 Through God we shall do great acts * and it is he that shall tread down our enemies.	Through God we shall do great acts * and it is he that shall tread down our enemies.	108013	1968
Psalm109.0	Psalm 109. Deus, laudem.	Psalm 109. Deus, laudem.	109000	1969
Psalm109.1	1 HOLD not thy tongue, O God of my praise * for the mouth of the ungodly, yea, the mouth of the deceitful is opened upon me.	HOLD not thy tongue, O God of my praise * for the mouth of the ungodly, yea, the mouth of the deceitful is opened upon me.	109001	1970
Psalm109.2	2 And they have spoken against me with false tongues * they compassed me about also with words of hatred, and fought against me without a cause.	And they have spoken against me with false tongues * they compassed me about also with words of hatred, and fought against me without a cause.	109002	1971
Psalm109.3	3 For the love that I had unto them, lo, they take now my contrary part * but I give myself unto prayer.	For the love that I had unto them, lo, they take now my contrary part * but I give myself unto prayer.	109003	1972
Psalm109.4	4 Thus have they rewarded me evil for good * and hatred for my good will.	Thus have they rewarded me evil for good * and hatred for my good will.	109004	1973
Psalm109.5	5 Set thou an ungodly man to be ruler over him * and let Satan stand at his right hand.	Set thou an ungodly man to be ruler over him * and let Satan stand at his right hand.	109005	1974
Psalm109.6	6 When sentence is given upon him, let him be condemned * and let his prayer be turned into sin.	When sentence is given upon him, let him be condemned * and let his prayer be turned into sin.	109006	1975
Psalm109.7	7 Let his days be few * and let another take his office.	Let his days be few * and let another take his office.	109007	1976
Psalm109.8	8 Let his children be fatherless * and his wife a widow.	Let his children be fatherless * and his wife a widow.	109008	1977
Psalm109.9	9 Let his children be vagabonds, and beg their bread * let them seek it also out of desolate places.	Let his children be vagabonds, and beg their bread * let them seek it also out of desolate places.	109009	1978
Psalm109.10	10 Let the extortioner consume all that he hath * and let the stranger spoil his labour.	Let the extortioner consume all that he hath * and let the stranger spoil his labour.	109010	1979
Psalm109.11	11 Let there be no man to pity him * nor to have compassion upon his fatherless children.	Let there be no man to pity him * nor to have compassion upon his fatherless children.	109011	1980
Psalm109.12	12 Let his posterity be destroyed * and in the next generation let his name be clean put out.	Let his posterity be destroyed * and in the next generation let his name be clean put out.	109012	1981
Psalm109.13	13 Let the wickedness of his fathers be had in remembrance in the sight of the Lord * and let not the sin of his mother be done away.	Let the wickedness of his fathers be had in remembrance in the sight of the Lord * and let not the sin of his mother be done away.	109013	1982
Psalm109.14	14 Let them alway be before the Lord * that he may root out the memorial of them from off the earth.	Let them alway be before the Lord * that he may root out the memorial of them from off the earth.	109014	1983
Psalm109.15	15 And that, because his mind was not to do good * but persecuted the poor helpless man, that he might slay him that was vexed at the heart.	And that, because his mind was not to do good * but persecuted the poor helpless man, that he might slay him that was vexed at the heart.	109015	1984
Psalm109.16	16 His delight was in cursing, and it shall happen unto him * he loved not blessing, therefore shall it be far from him.	His delight was in cursing, and it shall happen unto him * he loved not blessing, therefore shall it be far from him.	109016	1985
Psalm109.17	17 He clothed himself with cursing, like as with a raiment * and it shall come into his bowels like water, and like oil into his bones.	He clothed himself with cursing, like as with a raiment * and it shall come into his bowels like water, and like oil into his bones.	109017	1986
Psalm109.18	18 Let it be unto him as the cloke that he hath upon him * and as the girdle that he is alway girded withal.	Let it be unto him as the cloke that he hath upon him * and as the girdle that he is alway girded withal.	109018	1987
Psalm109.19	19 Let it thus happen from the Lord unto mine enemies * and to those that speak evil against my soul.	Let it thus happen from the Lord unto mine enemies * and to those that speak evil against my soul.	109019	1988
Psalm109.20	20 But deal thou with me, O Lord God, according unto thy Name * for sweet is thy mercy.	But deal thou with me, O Lord God, according unto thy Name * for sweet is thy mercy.	109020	1989
Psalm109.21	21 O deliver me, for I am helpless and poor * and my heart is wounded within me.	O deliver me, for I am helpless and poor * and my heart is wounded within me.	109021	1990
Psalm109.22	22 I go hence like the shadow that departeth * and am driven away as the grasshopper.	I go hence like the shadow that departeth * and am driven away as the grasshopper.	109022	1991
Psalm109.23	23 My knees are weak through fasting * my flesh is dried up for want of fatness.	My knees are weak through fasting * my flesh is dried up for want of fatness.	109023	1992
Psalm109.24	24 I became also a reproach unto them * they that looked upon me shaked their heads.	I became also a reproach unto them * they that looked upon me shaked their heads.	109024	1993
Psalm109.25	25 Help me, O Lord my God * O save me according to thy mercy.	Help me, O Lord my God * O save me according to thy mercy.	109025	1994
Psalm109.26	26 And they shall know, how that this is thy hand * and that thou, Lord, hast done it.	And they shall know, how that this is thy hand * and that thou, Lord, hast done it.	109026	1995
Psalm109.27	27 Though they curse, yet bless thou * and let them be confounded that rise up against me; but let thy servant rejoice.	Though they curse, yet bless thou * and let them be confounded that rise up against me; but let thy servant rejoice.	109027	1996
Psalm109.28	28 Let mine adversaries be clothed with shame * and let them cover themselves with their own confusion, as with a cloke.	Let mine adversaries be clothed with shame * and let them cover themselves with their own confusion, as with a cloke.	109028	1997
Psalm109.29	29 As for me, I will give great thanks unto the Lord with my mouth * and praise him among the multitude.	As for me, I will give great thanks unto the Lord with my mouth * and praise him among the multitude.	109029	1998
Psalm109.30	30 For he shall stand at the right hand of the poor * to save his soul from the unrighteous judges.	For he shall stand at the right hand of the poor * to save his soul from the unrighteous judges.	109030	1999
Psalm110.0	Psalm 110. Dixit Dominus.	Psalm 110. Dixit Dominus.	110000	2000
Psalm110.1	1 THE Lord said unto my Lord * Sit thou on my right hand, until I make thine enemies thy footstool.	THE Lord said unto my Lord * Sit thou on my right hand, until I make thine enemies thy footstool.	110001	2001
Psalm110.2	2 The Lord shall send the rod of thy power out of Sion * be thou ruler, even in the midst among thine enemies.	The Lord shall send the rod of thy power out of Sion * be thou ruler, even in the midst among thine enemies.	110002	2002
Psalm110.3	3 In the day of thy power shall the people offer thee free-will offerings with an holy worship * the dew of thy birth is of the womb of the morning.	In the day of thy power shall the people offer thee free-will offerings with an holy worship * the dew of thy birth is of the womb of the morning.	110003	2003
Psalm110.4	4 The Lord sware, and will not repent * Thou art a priest for ever after the order of Melchisedech.	The Lord sware, and will not repent * Thou art a priest for ever after the order of Melchisedech.	110004	2004
Psalm110.5	5 The Lord upon thy right hand * shall wound even kings in the day of his wrath.	The Lord upon thy right hand * shall wound even kings in the day of his wrath.	110005	2005
Psalm110.6	6 He shall judge among the heathen; he shall fill the places with the dead bodies * and smite in sunder the heads over divers countries.	He shall judge among the heathen; he shall fill the places with the dead bodies * and smite in sunder the heads over divers countries.	110006	2006
Psalm110.7	7 He shall drink of the brook in the way * therefore shall he lift up his head.	He shall drink of the brook in the way * therefore shall he lift up his head.	110007	2007
Psalm111.0	Psalm 111. Confitebor tibi.	Psalm 111. Confitebor tibi.	111000	2008
Psalm111.1	1 I WILL give thanks unto the Lord with my whole heart * secretly among the faithful, and in the congregation.	I WILL give thanks unto the Lord with my whole heart * secretly among the faithful, and in the congregation.	111001	2009
Psalm111.2	2 The works of the Lord are great * sought out of all them that have pleasure therein.	The works of the Lord are great * sought out of all them that have pleasure therein.	111002	2010
Psalm111.3	3 His work is worthy to be praised and had in honour * and his righteousness endureth for ever.	His work is worthy to be praised and had in honour * and his righteousness endureth for ever.	111003	2011
Psalm111.4	4 The merciful and gracious Lord hath so done his marvellous works * that they ought to be had in remembrance.	The merciful and gracious Lord hath so done his marvellous works * that they ought to be had in remembrance.	111004	2012
Psalm111.5	5 He hath given meat unto them that fear him * he shall ever be mindful of his covenant.	He hath given meat unto them that fear him * he shall ever be mindful of his covenant.	111005	2013
Psalm111.6	6 He hath shewed his people the power of his works * that he may give them the heritage of the heathen.	He hath shewed his people the power of his works * that he may give them the heritage of the heathen.	111006	2014
Psalm111.7	7 The works of his hands are verity and judgement * all his commandments are true.	The works of his hands are verity and judgement * all his commandments are true.	111007	2015
Psalm111.8	8 They stand fast for ever and ever * and are done in truth and equity.	They stand fast for ever and ever * and are done in truth and equity.	111008	2016
Psalm111.9	9 He sent redemption unto his people * he hath commanded his covenant for ever; holy and reverend is his Name.	He sent redemption unto his people * he hath commanded his covenant for ever; holy and reverend is his Name.	111009	2017
Psalm111.10	10 The fear of the Lord is the beginning of wisdom * a good understanding have all they that do thereafter; the praise of it endureth for ever.	The fear of the Lord is the beginning of wisdom * a good understanding have all they that do thereafter; the praise of it endureth for ever.	111010	2018
Psalm112.0	Psalm 112. Beatus vir.	Psalm 112. Beatus vir.	112000	2019
Psalm112.1	1 BLESSED is the man that feareth the Lord * he hath great delight in his commandments.	BLESSED is the man that feareth the Lord * he hath great delight in his commandments.	112001	2020
Psalm112.2	2 His seed shall be mighty upon earth * the generation of the faithful shall be blessed.	His seed shall be mighty upon earth * the generation of the faithful shall be blessed.	112002	2021
Psalm112.3	3 Riches and plenteousness shall be in his house * and his righteousness endureth for ever.	Riches and plenteousness shall be in his house * and his righteousness endureth for ever.	112003	2022
Psalm112.4	4 Unto the godly there ariseth up light in the darkness * he is merciful, loving, and righteous.	Unto the godly there ariseth up light in the darkness * he is merciful, loving, and righteous.	112004	2023
Psalm112.5	5 A good man is merciful, and lendeth * and will guide his words with discretion.	A good man is merciful, and lendeth * and will guide his words with discretion.	112005	2024
Psalm112.6	6 For he shall never be moved * and the righteous shall be had in everlasting remembrance.	For he shall never be moved * and the righteous shall be had in everlasting remembrance.	112006	2025
Psalm112.7	7 He will not be afraid of any evil tidings * for his heart standeth fast, and believeth in the Lord.	He will not be afraid of any evil tidings * for his heart standeth fast, and believeth in the Lord.	112007	2026
Psalm112.8	8 His heart is established, and will not shrink * until he see his desire upon his enemies.	His heart is established, and will not shrink * until he see his desire upon his enemies.	112008	2027
Psalm112.9	9 He hath dispersed abroad, and given to the poor * and his righteousness remaineth for ever; his horn shall be exalted with honour.	He hath dispersed abroad, and given to the poor * and his righteousness remaineth for ever; his horn shall be exalted with honour.	112009	2028
Psalm112.10	10 The ungodly shall see it, and it shall grieve him * he shall gnash with his teeth, and consume away; the desire of the ungodly shall perish.	The ungodly shall see it, and it shall grieve him * he shall gnash with his teeth, and consume away; the desire of the ungodly shall perish.	112010	2029
Psalm113.0	Psalm 113. Laudate, pueri.	Psalm 113. Laudate, pueri.	113000	2030
Psalm113.1	1 PRAISE the Lord, ye servants * O praise the Name of the Lord.	PRAISE the Lord, ye servants * O praise the Name of the Lord.	113001	2031
Psalm113.2	2 Blessed be the Name of the Lord * from this time forth for evermore.	Blessed be the Name of the Lord * from this time forth for evermore.	113002	2032
Psalm113.3	3 The Lord's Name is praised * from the rising up of the sun unto the going down of the same.	The Lord's Name is praised * from the rising up of the sun unto the going down of the same.	113003	2033
Psalm113.4	4 The Lord is high above all heathen * and his glory above the heavens.	The Lord is high above all heathen * and his glory above the heavens.	113004	2034
Psalm113.5	5 Who is like unto the Lord our God, that hath his dwelling so high * and yet humbleth himself to behold the things that are in heaven and earth?	Who is like unto the Lord our God, that hath his dwelling so high * and yet humbleth himself to behold the things that are in heaven and earth?	113005	2035
Psalm113.6	6 He taketh up the simple out of the dust * and lifteth the poor out of the mire;	He taketh up the simple out of the dust * and lifteth the poor out of the mire;	113006	2036
Psalm113.7	7 That he may set him with the princes * even with the princes of his people.	That he may set him with the princes * even with the princes of his people.	113007	2037
Psalm113.8	8 He maketh the barren woman to keep house * and to be a joyful mother of children.	He maketh the barren woman to keep house * and to be a joyful mother of children.	113008	2038
Psalm114.0	Psalm 114. In exitu Israel.	Psalm 114. In exitu Israel.	114000	2039
Psalm114.1	1 WHEN Israel came out of Egypt * and the house of Jacob from among the strange people,	WHEN Israel came out of Egypt * and the house of Jacob from among the strange people,	114001	2040
Psalm114.2	2 Judah was his sanctuary * and Israel his dominion.	Judah was his sanctuary * and Israel his dominion.	114002	2041
Psalm114.3	3 The sea saw that, and fled * Jordan was driven back.	The sea saw that, and fled * Jordan was driven back.	114003	2042
Psalm114.4	4 The mountains skipped like rams * and the little hills like young sheep.	The mountains skipped like rams * and the little hills like young sheep.	114004	2043
Psalm114.5	5 What aileth thee, O thou sea, that thou fleddest * and thou Jordan, that thou wast driven back?	What aileth thee, O thou sea, that thou fleddest * and thou Jordan, that thou wast driven back?	114005	2044
Psalm114.6	6 Ye mountains, that ye skipped like rams * and ye little hills, like young sheep?	Ye mountains, that ye skipped like rams * and ye little hills, like young sheep?	114006	2045
Psalm114.7	7 Tremble, thou earth, at the presence of the Lord * at the presence of the God of Jacob;	Tremble, thou earth, at the presence of the Lord * at the presence of the God of Jacob;	114007	2046
Psalm114.8	8 Who turned the hard rock into a standing water * and the flint-stone into a springing well.	Who turned the hard rock into a standing water * and the flint-stone into a springing well.	114008	2047
Psalm115.0	Psalm 115. Non nobis, Domine.	Psalm 115. Non nobis, Domine.	115000	2048
Psalm115.1	1 NOT unto us, O Lord, not unto us, but unto thy Name give the praise * for thy loving mercy and for thy truth's sake.	NOT unto us, O Lord, not unto us, but unto thy Name give the praise * for thy loving mercy and for thy truth's sake.	115001	2049
Psalm115.2	2 Wherefore shall the heathen say * Where is now their God?	Wherefore shall the heathen say * Where is now their God?	115002	2050
Psalm115.3	3 As for our God, he is in heaven * he hath done whatsoever pleased him.	As for our God, he is in heaven * he hath done whatsoever pleased him.	115003	2051
Psalm115.4	4 Their idols are silver and gold * even the work of men's hands.	Their idols are silver and gold * even the work of men's hands.	115004	2052
Psalm115.5	5 They have mouths, and speak not * eyes have they, and see not.	They have mouths, and speak not * eyes have they, and see not.	115005	2053
Psalm115.6	6 They have ears, and hear not * noses have they, and smell not.	They have ears, and hear not * noses have they, and smell not.	115006	2054
Psalm115.7	7 They have hands, and handle not; feet have they, and walk not * neither speak they through their throat.	They have hands, and handle not; feet have they, and walk not * neither speak they through their throat.	115007	2055
Psalm115.8	8 They that make them are like unto them ; and so are all such as put their trust in them.	They that make them are like unto them ; and so are all such as put their trust in them.	115008	2056
Psalm115.9	9 But thou, house of Israel, trust thou in the Lord * he is their succour and defence.	But thou, house of Israel, trust thou in the Lord * he is their succour and defence.	115009	2057
Psalm115.10	10 Ye house of Aaron, put your trust in the Lord * he is their helper and defender.	Ye house of Aaron, put your trust in the Lord * he is their helper and defender.	115010	2058
Psalm115.11	11 Ye that fear the Lord, put your trust in the Lord * he is their helper and defender.	Ye that fear the Lord, put your trust in the Lord * he is their helper and defender.	115011	2059
Psalm115.12	12 The Lord hath been mindful of us, and he shall bless us * even he shall bless the house of Israel, he shall bless the house of Aaron.	The Lord hath been mindful of us, and he shall bless us * even he shall bless the house of Israel, he shall bless the house of Aaron.	115012	2060
Psalm115.13	13 He shall bless them that fear the Lord * both small and great.	He shall bless them that fear the Lord * both small and great.	115013	2061
Psalm115.14	14 The Lord shall increase you more and more * you and your children.	The Lord shall increase you more and more * you and your children.	115014	2062
Psalm115.15	15 Ye are the blessed of the Lord * who made heaven and earth.	Ye are the blessed of the Lord * who made heaven and earth.	115015	2063
Psalm115.16	16 All the whole heavens are the Lord's * the earth hath he given to the children of men.	All the whole heavens are the Lord's * the earth hath he given to the children of men.	115016	2064
Psalm115.17	17 The dead praise not thee, O Lord * neither all they that go down into silence.	The dead praise not thee, O Lord * neither all they that go down into silence.	115017	2065
Psalm115.18	18 But we will praise the Lord * from this time forth for evermore. Praise the Lord.	But we will praise the Lord * from this time forth for evermore. Praise the Lord.	115018	2066
Psalm116.0	Psalm 116. Dilexi, quoniam.	Psalm 116. Dilexi, quoniam.	116000	2067
Psalm116.1	1 I AM well pleased * that the Lord hath heard the voice of my prayer;	I AM well pleased * that the Lord hath heard the voice of my prayer;	116001	2068
Psalm116.2	2 That he hath inclined his ear unto me * therefore will I call upon him as long as I live.	That he hath inclined his ear unto me * therefore will I call upon him as long as I live.	116002	2069
Psalm116.3	3 The snares of death compassed me round about * and the pains of hell gat hold upon me.	The snares of death compassed me round about * and the pains of hell gat hold upon me.	116003	2070
Psalm116.4	4 I shall find trouble and heaviness, and I will call upon the Name of the Lord * O Lord, I beseech thee, deliver my soul.	I shall find trouble and heaviness, and I will call upon the Name of the Lord * O Lord, I beseech thee, deliver my soul.	116004	2071
Psalm116.5	5 Gracious is the Lord, and righteous * yea, our God is merciful.	Gracious is the Lord, and righteous * yea, our God is merciful.	116005	2072
Psalm116.6	6 The Lord preserveth the simple * I was in misery, and he helped me.	The Lord preserveth the simple * I was in misery, and he helped me.	116006	2073
Psalm116.7	7 Turn again then unto thy rest, O my soul * for the Lord hath rewarded thee.	Turn again then unto thy rest, O my soul * for the Lord hath rewarded thee.	116007	2074
Psalm116.8	8 And why? thou hast delivered my soul from death * mine eyes from tears, and my feet from falling.	And why? thou hast delivered my soul from death * mine eyes from tears, and my feet from falling.	116008	2075
Psalm116.9	9 I will walk before the Lord * in the land of the living.	I will walk before the Lord * in the land of the living.	116009	2076
Psalm116.10	10 I believed, and therefore will I speak; but I was sore troubled * I said in my haste, All men are liars.	I believed, and therefore will I speak; but I was sore troubled * I said in my haste, All men are liars.	116010	2077
Psalm116.11	11 What reward shall I give unto the Lord * for all the benefits that he hath done unto me?	What reward shall I give unto the Lord * for all the benefits that he hath done unto me?	116011	2078
Psalm116.12	12 I will receive the cup of salvation * and call upon the Name of the Lord.	I will receive the cup of salvation * and call upon the Name of the Lord.	116012	2079
Psalm116.13	13 I will pay my vows now in the presence of all his people * right dear in the sight of the Lord is the death of his saints.	I will pay my vows now in the presence of all his people * right dear in the sight of the Lord is the death of his saints.	116013	2080
Psalm116.14	14 Behold, O Lord, how that I am thy servant * I am thy servant, and the son of thine handmaid; thou hast broken my bonds in sunder.	Behold, O Lord, how that I am thy servant * I am thy servant, and the son of thine handmaid; thou hast broken my bonds in sunder.	116014	2081
Psalm116.15	15 I will offer to thee the sacrifice of thanksgiving * and will call upon the Name of the Lord.	I will offer to thee the sacrifice of thanksgiving * and will call upon the Name of the Lord.	116015	2082
Psalm116.16	16 I will pay my vows unto the Lord, in the sight of all his people * in the courts of the Lord's house, even in the midst of thee, O Jerusalem. Praise the Lord.	I will pay my vows unto the Lord, in the sight of all his people * in the courts of the Lord's house, even in the midst of thee, O Jerusalem. Praise the Lord.	116016	2083
Psalm117.0	Psalm 117. Laudate Dominum.	Psalm 117. Laudate Dominum.	117000	2084
Psalm117.1	1 O PRAISE the Lord, all ye heathen * praise him, all ye nations.	O PRAISE the Lord, all ye heathen * praise him, all ye nations.	117001	2085
Psalm117.2	2 For his merciful kindness is ever more and more towards us * and the truth of the Lord endureth for ever. Praise the Lord.	For his merciful kindness is ever more and more towards us * and the truth of the Lord endureth for ever. Praise the Lord.	117002	2086
Psalm118.0	Psalm 118. Confitemini Domino.	Psalm 118. Confitemini Domino.	118000	2087
Psalm118.1	1 O GIVE thanks unto the Lord, for he is gracious * because his mercy endureth for ever.	O GIVE thanks unto the Lord, for he is gracious * because his mercy endureth for ever.	118001	2088
Psalm118.2	2 Let Israel now confess that he is gracious * and that his mercy endureth for ever.	Let Israel now confess that he is gracious * and that his mercy endureth for ever.	118002	2089
Psalm118.3	3 Let the house of Aaron now confess * that his mercy endureth for ever.	Let the house of Aaron now confess * that his mercy endureth for ever.	118003	2090
Psalm118.4	4 Yea, let them now that fear the Lord confess * that his mercy endureth for ever.	Yea, let them now that fear the Lord confess * that his mercy endureth for ever.	118004	2091
Psalm118.5	5 I called upon the Lord in trouble * and the Lord heard me at large.	I called upon the Lord in trouble * and the Lord heard me at large.	118005	2092
Psalm118.6	6 The Lord is on my side * I will not fear what man doeth unto me.	The Lord is on my side * I will not fear what man doeth unto me.	118006	2093
Psalm118.7	7 The Lord taketh my part with them that help me * therefore shall I see my desire upon mine enemies.	The Lord taketh my part with them that help me * therefore shall I see my desire upon mine enemies.	118007	2094
Psalm118.8	8 It is better to trust in the Lord * than to put any confidence in man.	It is better to trust in the Lord * than to put any confidence in man.	118008	2095
Psalm118.9	9 It is better to trust in the Lord * than to put any confidence in princes.	It is better to trust in the Lord * than to put any confidence in princes.	118009	2096
Psalm118.10	10 All nations compassed me round about * but in the Name of the Lord will I destroy them.	All nations compassed me round about * but in the Name of the Lord will I destroy them.	118010	2097
