Psalm37.34	34 The Lord will not leave him in his hand * nor condemn him when he is judged.	The Lord will not leave him in his hand * nor condemn him when he is judged.	37034	606
Psalm37.35	35 Hope thou in the Lord, and keep his way, and he shall promote thee, that thou shalt possess the land * when the ungodly shall perish, thou shalt see it.	Hope thou in the Lord, and keep his way, and he shall promote thee, that thou shalt possess the land * when the ungodly shall perish, thou shalt see it.	37035	607
Psalm37.36	36 I myself have seen the ungodly in great power * and flourishing like a green bay-tree.	I myself have seen the ungodly in great power * and flourishing like a green bay-tree.	37036	608
Psalm37.37	37 I went by, and lo, he was gone * I sought him, but his place could no where be found.	I went by, and lo, he was gone * I sought him, but his place could no where be found.	37037	609
Psalm37.38	38 Keep innocency, and take heed unto the thing that is right * for that shall bring a man peace at the last.	Keep innocency, and take heed unto the thing that is right * for that shall bring a man peace at the last.	37038	610
Psalm37.39	39 As for the transgressors, they shall perish together * and the end of the ungodly is, they shall be rooted out at the last.	As for the transgressors, they shall perish together * and the end of the ungodly is, they shall be rooted out at the last.	37039	611
Psalm37.40	40 But the salvation of the righteous cometh of the Lord * who is also their strength in the time of trouble.	But the salvation of the righteous cometh of the Lord * who is also their strength in the time of trouble.	37040	612
Psalm37.41	41 And the Lord shall stand by them, and save them * he shall deliver them from the ungodly, and shall save them, because they put their trust in him.	And the Lord shall stand by them, and save them * he shall deliver them from the ungodly, and shall save them, because they put their trust in him.	37041	613
Psalm38.0	Psalm 38. Domine, ne in furore.	Psalm 38. Domine, ne in furore.	38000	614
Psalm38.1	1 PUT me not to rebuke, O Lord, in thine anger * neither chasten me in thy heavy displeasure.	PUT me not to rebuke, O Lord, in thine anger * neither chasten me in thy heavy displeasure.	38001	615
Psalm38.2	2 For thine arrows stick fast in me * and thy hand presseth me sore.	For thine arrows stick fast in me * and thy hand presseth me sore.	38002	616
Psalm38.3	3 There is no health in my flesh, because of thy displeasure * neither is there any rest in my bones, by reason of my sin.	There is no health in my flesh, because of thy displeasure * neither is there any rest in my bones, by reason of my sin.	38003	617
Psalm38.4	4 For my wickednesses are gone over my head * and are like a sore burden, too heavy for me to bear.	For my wickednesses are gone over my head * and are like a sore burden, too heavy for me to bear.	38004	618
Psalm38.5	5 My wounds stink, and are corrupt * through my foolishness.	My wounds stink, and are corrupt * through my foolishness.	38005	619
Psalm38.6	6 I am brought into so great trouble and misery * that I go mourning all the day long.	I am brought into so great trouble and misery * that I go mourning all the day long.	38006	620
Psalm38.7	7 For my loins are filled with a sore disease * and there is no whole part in my body.	For my loins are filled with a sore disease * and there is no whole part in my body.	38007	621
Psalm38.8	8 I am feeble, and sore smitten * I have roared for the very disquietness of my heart.	I am feeble, and sore smitten * I have roared for the very disquietness of my heart.	38008	622
Psalm38.9	9 Lord, thou knowest all my desire * and my groaning is not hid from thee.	Lord, thou knowest all my desire * and my groaning is not hid from thee.	38009	623
Psalm38.10	10 My heart panteth, my strength hath failed me * and the sight of mine eyes is gone from me.	My heart panteth, my strength hath failed me * and the sight of mine eyes is gone from me.	38010	624
Psalm38.11	11 My lovers and my neighbours did stand looking upon my trouble * and my kinsmen stood afar off.	My lovers and my neighbours did stand looking upon my trouble * and my kinsmen stood afar off.	38011	625
Psalm38.12	12 They also that sought after my life laid snares for me * and they that went about to do me evil talked of wickedness, and imagined deceit all the day long.	They also that sought after my life laid snares for me * and they that went about to do me evil talked of wickedness, and imagined deceit all the day long.	38012	626
Psalm38.13	13 As for me, I was like a deaf man, and heard not * and as one that is dumb, who doth not open his mouth.	As for me, I was like a deaf man, and heard not * and as one that is dumb, who doth not open his mouth.	38013	627
Psalm38.14	14 I became even as a man that heareth not * and in whose mouth are no reproofs.	I became even as a man that heareth not * and in whose mouth are no reproofs.	38014	628
Psalm38.15	15 For in thee, O Lord, have I put my trust * thou shalt answer for me, O Lord my God.	For in thee, O Lord, have I put my trust * thou shalt answer for me, O Lord my God.	38015	629
Psalm38.16	16 I have required that they, even mine enemies, should not triumph over me * for when my foot slipped, they rejoiced greatly against me.	I have required that they, even mine enemies, should not triumph over me * for when my foot slipped, they rejoiced greatly against me.	38016	630
Psalm38.17	17 And I, truly, am set in the plague * and my heaviness is ever in my sight.	And I, truly, am set in the plague * and my heaviness is ever in my sight.	38017	631
Psalm38.18	18 For I will confess my wickedness * and be sorry for my sin.	For I will confess my wickedness * and be sorry for my sin.	38018	632
Psalm38.19	19 But mine enemies live, and are mighty * and they that hate me wrongfully are many in number.	But mine enemies live, and are mighty * and they that hate me wrongfully are many in number.	38019	633
Psalm38.20	20 They also that reward evil for good are against me * because I follow the thing that good is.	They also that reward evil for good are against me * because I follow the thing that good is.	38020	634
Psalm38.21	21 Forsake me not, O Lord my God * be not thou far from me.	Forsake me not, O Lord my God * be not thou far from me.	38021	635
Psalm38.22	22 Haste thee to help me * O Lord God of my salvation.	Haste thee to help me * O Lord God of my salvation.	38022	636
Psalm39.0	Psalm 39. Dixi, Custodiam.	Psalm 39. Dixi, Custodiam.	39000	637
Psalm39.1	1 I SAID, I will take heed to my ways * that I offend not in my tongue.	I SAID, I will take heed to my ways * that I offend not in my tongue.	39001	638
Psalm39.2	2 I will keep my mouth as it were with a bridle * while the ungodly is in my sight.	I will keep my mouth as it were with a bridle * while the ungodly is in my sight.	39002	639
Psalm39.3	3 I held my tongue, and spake nothing * I kept silence, yea, even from good words; but it was pain and grief to me.	I held my tongue, and spake nothing * I kept silence, yea, even from good words; but it was pain and grief to me.	39003	640
Psalm39.4	4 My heart was hot within me, and while I was thus musing the fire kindled * and at the last I spake with my tongue;	My heart was hot within me, and while I was thus musing the fire kindled * and at the last I spake with my tongue;	39004	641
Psalm39.5	5 Lord, let me know mine end, and the number of my days * that I may be certified how long I have to live.	Lord, let me know mine end, and the number of my days * that I may be certified how long I have to live.	39005	642
Psalm39.6	6 Behold, thou hast made my days as it were a span long * and mine age is even as nothing in respect of thee; and verily every man living is altogether vanity.	Behold, thou hast made my days as it were a span long * and mine age is even as nothing in respect of thee; and verily every man living is altogether vanity.	39006	643
Psalm39.7	7 For man walketh in a vain shadow, and disquieteth himself in vain * he heapeth up riches, and cannot tell who shall gather them.	For man walketh in a vain shadow, and disquieteth himself in vain * he heapeth up riches, and cannot tell who shall gather them.	39007	644
Psalm39.8	8 And now, Lord, what is my hope * truly my hope is even in thee.	And now, Lord, what is my hope * truly my hope is even in thee.	39008	645
Psalm39.9	9 Deliver me from all mine offences * and make me not a rebuke unto the foolish.	Deliver me from all mine offences * and make me not a rebuke unto the foolish.	39009	646
Psalm39.10	10 I became dumb, and opened not my mouth * for it was thy doing.	I became dumb, and opened not my mouth * for it was thy doing.	39010	647
Psalm39.11	11 Take thy plague away from me * I am even consumed by the means of thy heavy hand.	Take thy plague away from me * I am even consumed by the means of thy heavy hand.	39011	648
Psalm39.12	12 When thou with rebukes dost chasten man for sin, thou makest his beauty to consume away, like as it were a moth fretting a garment * every man therefore is but vanity.	When thou with rebukes dost chasten man for sin, thou makest his beauty to consume away, like as it were a moth fretting a garment * every man therefore is but vanity.	39012	649
Psalm39.13	13 Hear my prayer, O Lord, and with thine ears consider my calling * hold not thy peace at my tears.	Hear my prayer, O Lord, and with thine ears consider my calling * hold not thy peace at my tears.	39013	650
Psalm39.14	14 For I am a stranger with thee * and a sojourner, as all my fathers were.	For I am a stranger with thee * and a sojourner, as all my fathers were.	39014	651
Psalm39.15	15 O spare me a little, that I may recover my strength * before I go hence, and be no more seen.	O spare me a little, that I may recover my strength * before I go hence, and be no more seen.	39015	652
Psalm40.0	Psalm 40. Expectans expectavi.	Psalm 40. Expectans expectavi.	40000	653
Psalm40.1	1 I WAITED patiently for the Lord * and he inclined unto me, and heard my calling.	I WAITED patiently for the Lord * and he inclined unto me, and heard my calling.	40001	654
Psalm40.2	2 He brought me also out of the horrible pit, out of the mire and clay * and set my feet upon the rock, and ordered my goings.	He brought me also out of the horrible pit, out of the mire and clay * and set my feet upon the rock, and ordered my goings.	40002	655
Psalm40.3	3 And he hath put a new song in my mouth * even a thanksgiving unto our God.	And he hath put a new song in my mouth * even a thanksgiving unto our God.	40003	656
Psalm40.4	4 Many shall see it, and fear * and shall put their trust in the Lord.	Many shall see it, and fear * and shall put their trust in the Lord.	40004	657
Psalm40.5	5 Blessed is the man that hath set his hope in the Lord * and turned not unto the proud, and to such as go about with lies.	Blessed is the man that hath set his hope in the Lord * and turned not unto the proud, and to such as go about with lies.	40005	658
Psalm40.6	6 O Lord my God, great are the wondrous works which thou hast done, like as be also thy thoughts which are to us-ward * and yet there is no man that ordereth them unto thee:	O Lord my God, great are the wondrous works which thou hast done, like as be also thy thoughts which are to us-ward * and yet there is no man that ordereth them unto thee:	40006	659
Psalm40.7	7 If I should declare them, and speak of them * they should be more than I am able to express.	If I should declare them, and speak of them * they should be more than I am able to express.	40007	660
Psalm40.8	8 Sacrifice and meat-offering thou wouldest not * but mine ears hast thou opened.	Sacrifice and meat-offering thou wouldest not * but mine ears hast thou opened.	40008	661
Psalm40.9	9 Burnt-offerings, and sacrifice for sin, hast thou not required * then said I, Lo, I come,	Burnt-offerings, and sacrifice for sin, hast thou not required * then said I, Lo, I come,	40009	662
Psalm40.10	10 In the volume of the book it is written of me, that I should fulfil thy will, O my God * I am content to do it; yea, thy law is within my heart.	In the volume of the book it is written of me, that I should fulfil thy will, O my God * I am content to do it; yea, thy law is within my heart.	40010	663
Psalm40.11	11 I have declared thy righteousness in the great congregation * lo, I will not refrain my lips, O Lord, and that thou knowest.	I have declared thy righteousness in the great congregation * lo, I will not refrain my lips, O Lord, and that thou knowest.	40011	664
Psalm40.12	12 I have not hid thy righteousness within my heart * my talk hath been of thy truth and of thy salvation.	I have not hid thy righteousness within my heart * my talk hath been of thy truth and of thy salvation.	40012	665
Psalm40.13	13 I have not kept back thy loving mercy and truth * from the great congregation.	I have not kept back thy loving mercy and truth * from the great congregation.	40013	666
Psalm40.14	14 Withdraw not thou thy mercy from me, O Lord * let thy loving-kindness and thy truth alway preserve me.	Withdraw not thou thy mercy from me, O Lord * let thy loving-kindness and thy truth alway preserve me.	40014	667
Psalm40.15	15 For innumerable troubles are come about me; my sins have taken such hold upon me that I am not able to look up * yea, they are more in number than the hairs of my head, and my heart hath failed me.	For innumerable troubles are come about me; my sins have taken such hold upon me that I am not able to look up * yea, they are more in number than the hairs of my head, and my heart hath failed me.	40015	668
Psalm40.16	16 O Lord, let it be thy pleasure to deliver me * make haste, O Lord, to help me.	O Lord, let it be thy pleasure to deliver me * make haste, O Lord, to help me.	40016	669
Psalm40.17	17 Let them be ashamed and confounded together, that seek after my soul to destroy it * let them be driven backward and put to rebuke, that wish me evil.	Let them be ashamed and confounded together, that seek after my soul to destroy it * let them be driven backward and put to rebuke, that wish me evil.	40017	670
Psalm40.18	18 Let them be desolate, and rewarded with shame * that say unto me, Fie upon thee, fie upon thee.	Let them be desolate, and rewarded with shame * that say unto me, Fie upon thee, fie upon thee.	40018	671
Psalm40.19	19 Let all those that seek thee be joyful and glad in thee * and let such as love thy salvation say alway, The Lord be praised.	Let all those that seek thee be joyful and glad in thee * and let such as love thy salvation say alway, The Lord be praised.	40019	672
Psalm40.20	20 As for me, I am poor and needy * but the Lord careth for me.	As for me, I am poor and needy * but the Lord careth for me.	40020	673
Psalm40.21	21 Thou art my helper and redeemer * make no long tarrying, O my God.	Thou art my helper and redeemer * make no long tarrying, O my God.	40021	674
Psalm41.0	Psalm 41. Beatus qui intelligit.	Psalm 41. Beatus qui intelligit.	41000	675
Psalm41.1	1 BLESSED is he that considereth the poor and needy * the Lord shall deliver him in the time of trouble.	BLESSED is he that considereth the poor and needy * the Lord shall deliver him in the time of trouble.	41001	676
Psalm41.2	2 The Lord preserve him, and keep him alive, that he may be blessed upon earth * and deliver not thou him into the will of his enemies.	The Lord preserve him, and keep him alive, that he may be blessed upon earth * and deliver not thou him into the will of his enemies.	41002	677
Psalm41.3	3 The Lord comfort him, when he lieth sick upon his bed * make thou all his bed in his sickness.	The Lord comfort him, when he lieth sick upon his bed * make thou all his bed in his sickness.	41003	678
Psalm41.4	4 I said, Lord, be merciful unto me * heal my soul, for I have sinned against thee.	I said, Lord, be merciful unto me * heal my soul, for I have sinned against thee.	41004	679
Psalm41.5	5 Mine enemies speak evil of me * When shall he die, and his name perish?	Mine enemies speak evil of me * When shall he die, and his name perish?	41005	680
Psalm41.6	6 And if he come to see me, he speaketh vanity * and his heart conceiveth falsehood within himself, and when he cometh forth he telleth it.	And if he come to see me, he speaketh vanity * and his heart conceiveth falsehood within himself, and when he cometh forth he telleth it.	41006	681
Psalm41.7	7 All mine enemies whisper together against me * even against me do they imagine this evil.	All mine enemies whisper together against me * even against me do they imagine this evil.	41007	682
Psalm41.8	8 Let the sentence of guiltiness proceed against him * and now that he lieth, let him rise up no more.	Let the sentence of guiltiness proceed against him * and now that he lieth, let him rise up no more.	41008	683
Psalm41.9	9 Yea, even mine own familiar friend, whom I trusted * who did also eat of my bread, hath laid great wait for me.	Yea, even mine own familiar friend, whom I trusted * who did also eat of my bread, hath laid great wait for me.	41009	684
Psalm41.10	10 But be thou merciful unto me, O Lord * raise thou me up again, and I shall reward them.	But be thou merciful unto me, O Lord * raise thou me up again, and I shall reward them.	41010	685
Psalm41.11	11 By this I know thou favourest me * that mine enemy doth not triumph against me.	By this I know thou favourest me * that mine enemy doth not triumph against me.	41011	686
Psalm41.12	12 And when I am in my health, thou upholdest me * and shalt set me before thy face for ever.	And when I am in my health, thou upholdest me * and shalt set me before thy face for ever.	41012	687
Psalm41.13	13 Blessed be the Lord God of Israel * world without end. Amen.	Blessed be the Lord God of Israel * world without end. Amen.	41013	688
Psalm42.0	Psalm 42. Quemadmodum.	Psalm 42. Quemadmodum.	42000	689
Psalm42.1	1 LIKE as the hart desireth the water-brooks * so longeth my soul after thee, O God.	LIKE as the hart desireth the water-brooks * so longeth my soul after thee, O God.	42001	690
Psalm42.2	2 My soul is athirst for God, yea, even for the living God * when shall I come to appear before the presence of God?	My soul is athirst for God, yea, even for the living God * when shall I come to appear before the presence of God?	42002	691
Psalm42.3	3 My tears have been my meat day and night * while they daily say unto me, Where is now thy God?	My tears have been my meat day and night * while they daily say unto me, Where is now thy God?	42003	692
Psalm42.4	4 Now when I think thereupon, I pour out my heart by myself * for I went with the multitude, and brought them forth into the house of God;	Now when I think thereupon, I pour out my heart by myself * for I went with the multitude, and brought them forth into the house of God;	42004	693
Psalm42.5	5 In the voice of praise and thanksgiving * among such as keep holy-day.	In the voice of praise and thanksgiving * among such as keep holy-day.	42005	694
Psalm42.6	6 Why art thou so full of heaviness, O my soul * and why art thou so disquieted within me?	Why art thou so full of heaviness, O my soul * and why art thou so disquieted within me?	42006	695
Psalm42.7	7 Put thy trust in God * for I will yet give him thanks for the help of his countenance.	Put thy trust in God * for I will yet give him thanks for the help of his countenance.	42007	696
Psalm42.8	8 My God, my soul is vexed within me * therefore will I remember thee concerning the land of Jordan, and the little hill of Hermon.	My God, my soul is vexed within me * therefore will I remember thee concerning the land of Jordan, and the little hill of Hermon.	42008	697
Psalm42.9	9 One deep calleth another, because of the noise of the water-pipes * all thy waves and storms are gone over me.	One deep calleth another, because of the noise of the water-pipes * all thy waves and storms are gone over me.	42009	698
Psalm42.10	10 The Lord hath granted his loving-kindness in the day-time * and in the night-season did I sing of him, and made my prayer unto the God of my life.	The Lord hath granted his loving-kindness in the day-time * and in the night-season did I sing of him, and made my prayer unto the God of my life.	42010	699
Psalm42.11	11 I will say unto the God of my strength, Why hast thou forgotten me * why go I thus heavily, while the enemy oppresseth me?	I will say unto the God of my strength, Why hast thou forgotten me * why go I thus heavily, while the enemy oppresseth me?	42011	700
Psalm42.12	12 My bones are smitten asunder as with a sword * while mine enemies that trouble me cast me in the teeth;	My bones are smitten asunder as with a sword * while mine enemies that trouble me cast me in the teeth;	42012	701
Psalm42.13	13 Namely, while they say daily unto me * Where is now thy God?	Namely, while they say daily unto me * Where is now thy God?	42013	702
Psalm42.14	14 Why art thou so vexed, O my soul * and why art thou so disquieted within me?	Why art thou so vexed, O my soul * and why art thou so disquieted within me?	42014	703
Psalm42.15	15 O put thy trust in God * for I will yet thank him, which is the help of my countenance, and my God.	O put thy trust in God * for I will yet thank him, which is the help of my countenance, and my God.	42015	704
Psalm43.0	Psalm 43. Judica me, Deus.	Psalm 43. Judica me, Deus.	43000	705
Psalm43.1	1 GIVE sentence with me, O God, and defend my cause against the ungodly people * O deliver me from the deceitful and wicked man.	GIVE sentence with me, O God, and defend my cause against the ungodly people * O deliver me from the deceitful and wicked man.	43001	706
Psalm43.2	2 For thou art the God of my strength, why hast thou put me from thee * and why go I so heavily, while the enemy oppresseth me?	For thou art the God of my strength, why hast thou put me from thee * and why go I so heavily, while the enemy oppresseth me?	43002	707
Psalm43.3	3 O send out thy light and thy truth, that they may lead me * and bring me unto thy holy hill, and to thy dwelling.	O send out thy light and thy truth, that they may lead me * and bring me unto thy holy hill, and to thy dwelling.	43003	708
Psalm43.4	4 And that I may go unto the altar of God, even unto the God of my joy and gladness * and upon the harp will I give thanks unto thee, O God, my God.	And that I may go unto the altar of God, even unto the God of my joy and gladness * and upon the harp will I give thanks unto thee, O God, my God.	43004	709
Psalm43.5	5 Why art thou so heavy, O my soul * and why art thou so disquieted within me?	Why art thou so heavy, O my soul * and why art thou so disquieted within me?	43005	710
Psalm43.6	6 O put thy trust in God * for I will yet give him thanks, which is the help of my countenance, and my God.	O put thy trust in God * for I will yet give him thanks, which is the help of my countenance, and my God.	43006	711
Psalm44.0	Psalm 44. Deus, auribus.	Psalm 44. Deus, auribus.	44000	712
Psalm44.1	1 WE HAVE heard with our ears, O God, our fathers have told us * what thou hast done in their time of old;	WE HAVE heard with our ears, O God, our fathers have told us * what thou hast done in their time of old;	44001	713
Psalm44.2	2 How thou hast driven out the heathen with thy hand, and planted them in * how thou hast destroyed the nations and cast them out.	How thou hast driven out the heathen with thy hand, and planted them in * how thou hast destroyed the nations and cast them out.	44002	714
Psalm44.3	3 For they gat not the land in possession through their own sword * neither was it their own arm that helped them;	For they gat not the land in possession through their own sword * neither was it their own arm that helped them;	44003	715
Psalm44.4	4 But thy right hand, and thine arm, and the light of thy countenance * because thou hadst a favour unto them.	But thy right hand, and thine arm, and the light of thy countenance * because thou hadst a favour unto them.	44004	716
Psalm44.5	5 Thou art my King, O God * send help unto Jacob.	Thou art my King, O God * send help unto Jacob.	44005	717
Psalm44.6	6 Through thee will we overthrow our enemies * and in thy Name will we tread them under, that rise up against us.	Through thee will we overthrow our enemies * and in thy Name will we tread them under, that rise up against us.	44006	718
Psalm44.7	7 For I will not trust in my bow * it is not my sword that shall help me;	For I will not trust in my bow * it is not my sword that shall help me;	44007	719
Psalm44.8	8 But it is thou that savest us from our enemies * and puttest them to confusion that hate us.	But it is thou that savest us from our enemies * and puttest them to confusion that hate us.	44008	720
Psalm44.9	9 We make our boast of God all day long * and will praise thy Name for ever.	We make our boast of God all day long * and will praise thy Name for ever.	44009	721
Psalm44.10	10 But now thou art far off, and puttest us to confusion * and goest not forth with our armies.	But now thou art far off, and puttest us to confusion * and goest not forth with our armies.	44010	722
Psalm44.11	11 Thou makest us to turn our backs upon our enemies * so that they which hate us spoil our goods.	Thou makest us to turn our backs upon our enemies * so that they which hate us spoil our goods.	44011	723
Psalm44.12	12 Thou lettest us be eaten up like sheep * and hast scattered us among the heathen.	Thou lettest us be eaten up like sheep * and hast scattered us among the heathen.	44012	724
Psalm44.13	13 Thou sellest thy people for nought * and takest no money for them.	Thou sellest thy people for nought * and takest no money for them.	44013	725
Psalm44.14	14 Thou makest us to be rebuked of our neighbours * to be laughed to scorn, and had in derision of them that are round about us.	Thou makest us to be rebuked of our neighbours * to be laughed to scorn, and had in derision of them that are round about us.	44014	726
