Septuagesima Sunday	Circumdederunt. Psalm  18.	THE sorrows of death compassed me, the pains of hell gat hold upon me * and in my tribulation I made my prayer unto the Lord, and he regarded my supplication out of his holy temple.	Psalm ibid.  I will love thee, O Lord my strength * the Lord is my stony rock, my fortress, and my Saviour. ✠Glory be &c	Collect not found	Psalm 9.	Praise to Thee, O Christ, King of Eternal glory. The Lord will be a refuge in the time of trouble: and they that know thy Name will put their trust in thee: for thou, Lord, hast never failed them that seek thee. For the poor shall not always be forgotten: the patient abiding of the meek shall not perish for ever * up Lord, and let not man have the upper hand.	Psalm 92:1. It is a good thing to give thanks unto the Lord, and to sing praises unto thy Name, O Most Highest.	WE beseech thee, O Lord, graciously to accept these our prayers and oblations: that we being cleansed by these heavenly mysteries, may obtain of thy great mercy the fulfilment of all our desires. Through.		Psalm 31.	Shew thy servant the light of thy countenance, and save me for thy mercy's sake * let me not be confounded, O Lord, for I have called upon thee.	STRENGTHEN, O Lord, we pray thee, with these thy gifts the wills of thy faithful people: that we receiving the same may seek them more earnestly, and seeking the same may obtain them everlastingly. Through &c.		19
Sexagesima Sunday	Exsurge. Psalm  44.	UP, Lord, why sleepest thou? Awake, and be not absent from us for ever: wherefore hidest thou thy face? and forgettest our misery and trouble? Our belly cleaveth unto the ground * arise, and help us, and deliver us.	Psalm ibid. O God, we have heard with our ears * our fathers have declared unto us. ✠Glory be &c	Collect not found	Psalm 83.	Praise to Thee, O Christ, King of Eternal glory. Let the heathen know that thou, whose Name is Jehovah: art only the Most Highest over all the earth. O my God, make them like unto a wheel * and as the stubble before the wind.	Psalm 17:5-7. O hold thou up my goings in thy paths, that my footsteps slip not: incline thine ear to me, and hearken unto my words * shew thy marvellous loving-kindness, O Lord, thou that art the Saviour of them which put their trust in thee.	WE beseech thee, O Lord, that this sacrifice, which we offer unto thee, may evermore avail to quicken and defend us. Through.		Psalm 43.	I will go unto the altar of God * even unto the God of my joy and gladness.	WE humbly beseech thee, Almighty God: that we whom thou dost vouchsafe to regenerate with thy holy sacraments; may continually serve thee in all virtuous and godly living. Through &c.		20
Quinquagesima Sunday	Esto mihi. Psalm  31.	BE thou my strong rock, and house of defence, that thou mayest save me: for thou art my strong rock, and my castle * be thou also my guide, and lead me for thy Name's sake.	Psalm ibid. In thee, O Lord, have I put my trust, let me never be put to confusion * but rid me and deliver me in thy righteousness ✠Glory be &c	Collect not found	Psalm 77.	Praise to Thee, O Christ, King of Eternal glory. Thou art the God, that doeth wonders: and hast declared thy power among the people. Thou hast mightily delivered thy people * even the sons of Jacob and Joseph.	Psalm 119. Blessed art thou, O Lord, O teach me thy statutes * with my lips have I been telling of all the judgements of thy mouth.	GRANT, O Lord, we pray thee that this oblation may in such wise cleanse us from all our sins: that we, thy servants, being sanctified both in body and soul, may worthily offer unto thee this our sacrifice.  Through &c		Psalm 78.	They did eat and were well filled, for the Lord gave them their own desire * they were not disappointed of their lust.	WE beseech thee, Almighty God:that we who have received this heavenly food, may thereby be defended against all adversities. Through &c.		18
Ash Wednesday	Misereris amnium. Wisdom 11.	THOU hast mercy upon all, O Lord, and abhorrest nothing which thou hast made, and winkest at the sins of men, because they should amend, and sparest them * for thou art the Lord our God.	Psalm 57. Be merciful unto me, O God, be merciful unto me * for my soul trusteth in thee. ✠Glory be &c	ALMIGHTY and everlasting God, who hatest nothing that thou hast made and dost forgive the sins of all those who are penitent: create and make in us new and contrite hearts, that we, worthily lamenting our sins and acknowledging our wretchedness, may obtain of thee, the God of all mercy, perfect remission and forgiveness; through Jesus Christ thy Son our Lord, who liveth and reigneth with thee, in the unity of the Holy Spirit, ever one God, world without end. * Amen.	Psalm 57.	Praise to Thee, O Christ, King of Eternal glory. Be merciful unto me, O God, be merciful unto me * for my soul trusteth in thee. He shall send from heaven, and save me from the reproof of him that would eat me up.	Psalm 30. I will magnify thee, O Lord, for thou hast set me up, and not made my foes to triumph over me * O Lord, my God, I cried unto thee, and thou hast healed me.	Grant, we beseech thee, O Lord, that like as we do by these our oblations bring to remembrance the institution of this holy Sacrament, so we may by thee be enabled to offer the same according to thy will. Through.		Psalm 1.	He who doth meditate on the law of the Lord day and night * will bring forth his fruit in due season.	WE beseech thee, Lord, mercifully to protect us who have now received this holy Sacrament: that this our fast may be acceptable in thy sight, and profitable unto us for the healing of our souls, Through &c ¶ Then the Priest without any other Salutation to the People, shall say: Let us pray. And the Deacon, if any be ministering in the office of Deacon, shall turn about to the People with hands joined and say, Bow down before the Lord. Else shall the Priest himself say thus, standing in the same place afore the book and not turning about to the people.		21
Lent I	Invocabit me. Psalm  91.	HE shall call on me and I will hearken unto him: I will deliver him and baring him to honour * with length of days will I satisfy him.	Psalm ibid. Whoso dwelleth under the defence of the Most High * shall abide under the shadow of the Almighty. ✠Glory be &c	O LORD who for our sake didst fast forty days and forty nights: give us grace to use such abstinence, that, our flesh being subdued to the Spirit; we may ever obey thy godly motions in righteousness and true holiness, to thy honour and glory; who livest and reignest with the Father in the unity of the Holy Spirit, ever one God, world without end. * Amen.	Psalm 91.	Praise to Thee, O Christ, King of Eternal glory. He shall give his Angels charge over thee: to keep thee in all thy ways. They shall bear thee in their hands * that thou hurt not thy foot against a stone.	Psalm 91. The Lord shall defend thee under his wings, and thou shalt be safe under his feathers * his faithfulness and truth shall be thy shield and buckler.	GRANT, we beseech thee, O Lord, that we which offer unto thee this sacrifice in the beginning of our fast, may use such abstinence from carnal feastings, that we may likewise refrain ourselves from all pleasures that may hurt the soul. Through.		Psalm 78.	They did eat and were well filled, for the Lord gave them their own desire * they were not disappointed of their lust.	GRANT, O Lord, that this holy Sacrament, which we have received: may in such wise deliver us from our former nature; that we may be worthy to enter into the fellowship of thy saving mysteries. Through &c.		22
Lent II	Reminiscere. Psalm  25.	CALL to remembrance, O Lord, thy tender mercies, and thy loving-kindnesses, which have been ever of old: O let not our enemies triumph over us * deliver us, O God of Israel, out of all our troubles.	Unto thee, O Lord, will I lift up my soul * O my God, I have put my trust in thee, O let me not be confounded. ✠Glory be &c	ALMIGHTY God, who seest that we have no power of ourselves to help ourselves: keep us both outwardly in our bodies, and inwardly in our souls; that we may be defended from all adversities which may happen to the body, and from all evil thoughts which may assault and hurt the soul; through Jesus Christ thy Son our Lord, who liveth and reigneth with thee, in the unity of the Holy Spirit, ever one God, world without end. * Amen.	Psalm 25.	Praise to Thee, O Christ, King of Eternal glory. The sorrows of my heart are enlarged: O bring thou me out of my troubles, O Lord. Look upon my adversity and misery * and forgive me all my sin.	Psalm 119. My delight shall be in thy commandments which I have loved exceedingly * my hands also will I lift up unto thy commandments, which I have loved.	WE BESEECH thee, O Lord, mercifully to have respect unto these our oblations: that the same may be profitable unto us for our increase in all godliness, and for the advancement of everlasting salvation. Through.		Psalm 5.	Consider my meditation: hearken thou unto the voice of my calling, my King and my God * for unto thee will I make my prayer, O Lord.	WE humbly beseech thee, Almighty God: that we whom thou dost vouchsafe to regenerate with thy holy sacraments; may continually serve thee in all virtuous and godly living. Through &c.		23
Lent III	Oculi mei. Psalm  25.	MINE eyes are ever looking unto the Lord, for he shall pluck my feet out of the net: turn thee unto me, and have mercy upon me * for I am desolate and in misery.	O Lord, will I lift up my soul * my God, in thee have I put my trust, let me not be confounded. ✠Glory be &c	WE BESEECH thee, almighty God, look upon the hearty desires of thy humble servants: and stretch forth the right hand of thy Majesty; to be our defence against all our enemies; through Jesus Christ thy Son our Lord, who liveth and reigneth with thee, in the unity of the Holy Spirit, ever one God, world without end. * Amen.	Psalm 9.	Praise to Thee, O Christ, King of Eternal glory. Up, Lord, and let not man have the upper hand * let the heathen be judged in thy sight. While mine enemies are driven back, they shall fall and perish at thy presence.	Psalm 19. The statues of the Lord are right, and rejoice the heart, sweeter also than honey and the honeycomb * moreover thy servant keepeth them.	GRANT, O Lord, we pray thee, that this oblation may in such wise cleanse us from all our sins: that we thy servants, being sanctified both in body and soul, may worthily offer unto thee this our sacrifice.  Through &c		Psalm 84.	The sparrow hath found her an house, and the swallow a nest, where she may lay her young: even thy altars, O Lord of hosts, my King and my God: blessed are they that dwell in thy house * they will be alway praising thee.	O LORD, who sufferest us to be partakers of thy wondrous mysteries: grant, we beseech thee; that by thy mercy we may be absolved from all our iniquities, and defended against all adversities. Through &c.		24
Lent IV	Laetare. Isaiah 66.	REJOICE ye with Jerusalem: and be glad with her, all ye that love her: rejoice for joy with her, all ye that mourn for her * that ye may suck, and be satisfied with the breast of her consolations.	Psalm 122. I was glad when the said unto me * We will go into the house of the Lord. ✠Glory be &c	GRANT, we beseech thee, almighty God: that we, who for our evil deeds do worthily deserve to be punished; by the comfort of thy grace may mercifully be relieved; through our Lord and Saviour Jesus Christ, who liveth and reigneth with thee, in the unity of the Holy Spirit, ever one God, world without end. * Amen.	Psalm 122.	Praise to Thee, O Christ, King of Eternal glory. I was glad when they said unto me * We will go into the house of the Lord. Peace be within thy walls, and plenteousness within thy palaces.	Psalm 135. O praise the Lord, for the Lord is gracious: O sing praises unto his Name, for it is lovely * whatsoever the Lord pleased, that did he in heaven and in earth.	WE beseech thee, O Lord, mercifully to have respect unto these our oblations: that the same may be profitable unto us for our increase in all godliness, and for the attainment of everlasting salvation.  Through &c		Psalm 122.	Jerusalem is built as a city that is at unity with itself * for thither the tribes go up, even the tribes of the Lord, to give thanks unto the Name of the Lord.	O LORD, who sufferest us to be partakers of thy wondrous mysteries: grant, we beseech thee; that by thy mercy we may be absolved from all our iniquities, and defended against all adversities. Through &c.		25
Passion Sunday	Judica me. Psalm  43.	GIVE sentence with me, O God, and defend my cause against the ungodly people: O deliver my soul from the deceitful and wicked man * for thou art the God of my strength.	Psalm Ibid. O send out thy light and thy truth, that they may lead me * and bring me unto thy holy hill, and to thy dwelling. ✠Glory be &c	WE BESEECH thee, almighty God, mercifully to look upon thy people: that by thy great goodness they may be governed and preserved evermore, both in body and soul; through Jesus Christ thy Son our Lord, who liveth and reigneth with thee, in the unity of the Holy Spirit, ever one God, world without end. * Amen.	Psalm l43.	Praise to Thee, O Christ, King of Eternal glory. Deliver me, O Lord, from mine enemies: teach me to do the thing that pleaseth thee. It is the Lord that delivereth me from my cruel enemies, and setteth me up above mine adversaries * thou shalt rid me from the wicked man.	Psalm 119. I will give thanks unto the Lord with my whole heart O do well unto thy servant, that I may live, and keep thy word * quicken thou me, according to thy word, O Lord.	Grant, O Lord, we pray thee, that these our oblations may deliver us from every bond of iniquity, and obtain for us the bounteous gifts of thy mercy. Through.		1 Corinthians 11.	This is my Body, which is given for you: this cup is the new testament in my Blood, saith the Lord * this do ye, as oft as ye drink it, in remembrance of me.	ASSIST us mercifully, O Lord our God: that we whom thou hast here refreshed with thy holy mysteries, may be defended by thy perpetual succour. Through &c.		26
Palm Sunday	Domine, ne longe. Psalm  22.	BE NOT thou far from me, O Lord, thou art my succour, haste thee to help me * save me from the lion's mouth, thou hast heard me also from among the horns of the unicorns.	Psalm ibid. My God, my God, look upon me: why hast thou forsaken me * and art so far from my health, and from the words of my complaint? Be not thou. ✠Glory be &c	ALMIGHTY and everlasting God, who, of thy tender love towards mankind, hast sent thy Son our Saviour Jesus Christ, to take upon him our flesh, and to suffer death upon the Cross, that all mankind should follow the example of his great humility: mercifully grant; that we may follow the example of his patience, and so be made partakers of his Resurrection; through the same Jesus Christ thy Son our Lord, who liveth and reigneth with thee, in the unity of the Holy Spirit, ever one God, world without end. * Amen.	Psalm 73.	Praise to Thee, O Christ, King of Eternal glory. Thou hast holden me by my right hand: thou shalt guide me with thy counsel: and after that receive me with glory. Truly God is loving unto Israel, even unto such as are of a clean heart: nevertheless, my feet were almost gone: my treadings had well-nigh slipt: and why? I was grieved at the wicked, I do also see the ungodly in such prosperity.	Psalm 69. Thy rebuke hath broken my heart, I am full of heaviness: I looked for some to have pity on me, but there was no man: neither found I any to comfort me * they gave me gall to eat, and when I was thirsty they gave me vinegar to drink.	Grant, we beseech thee, Almighty God: that these gifts which we offer in the sight of thy divine majesty, may obtain for us grace to serve thee in this life with all godliness, and bring us in the end to everlasting felicity. Through.		St Matthew 26.	O my Father, if this cup may not pass away from me, except I drink it * thy will be done.	GRANT, O Lord, that by the operation of these thy mysteries, we may be cleansed from all our sins: and obtain that which we have asked according to thy will. Through &c.		27
Easter Sunday	Resurrexi. Psalm  139.	I AM risen, and am present with thee, alleluia * thou hast laid thine hand upon me, alleluia; such knowledge is too wonderful and excellent for me, alleluia, alleluia.	Psalm ibid. O Lord, thou hast searched me out and known me * thou knowest my down sitting and mine uprising. ✠Glory be &c	ALMIGHTY God, who through thine Only Begotten Son Jesus Christ hast overcome death, and opened unto us the gate of everlasting life: we humbly beseech thee; that as by thy special grace thou dost put into our minds good desires, so by thy continual help we may bring the same to good effect; through the same Jesus Christ thy Son, our Lord, who liveth and reigneth with thee, in the unity of the Holy Spirit, ever one God, world without end. * Amen.	1 Corinthians 5.	Alleluia, alleluia. Christ our Passover is sacrificed for us.	Psalm 76. The earth trembled and was still, when God arose to judgement, alleluia.	WE BESEECH thee, O Lord, mercifully to accept the prayers and oblations of thy people: that this beginning of thy Paschal Mysteries may by the operation of thy grace be unto us a wholesome medicine unto everlasting life. Through.		1 Corinthians 5.	Christ our Passover is sacrificed for us, alleluia * therefore let us keep the feast with the unleavened bread of sincerity and truth, alleluia, alleluia, alleluia.	WE BESEECH thee, O Lord, put into our hearts the love of thy Holy Spirit: that as thou hast now fulfilled us with this Paschal Sacrament, so thou wouldest make us to continue in all godly concord. Through &c	SEQUENCE. Victimae Paschali. Christians to the Paschal Victim offer your thankful praises. The Lamb the sheep redeemeth: Christ by sin undefiled, reconcileth sinners to the Father. Death and life joined together in that conflict stupendous : the King of Life who died deathless reigneth. Declare to us, Mary, the vision of thy journey. "I saw the Tomb of Christ living: and likewise the glory of the Risen: Bright Angels attesting, the shroud and napkin resting. Yea, Christ my hope is arisen : to Galilee he now goes before you." Christ indeed from death is risen, so we know most surely: O King and Conqueror, grant to us mercy, Amen. Alleluia.	29
Easter II	Quasi modo. 1 St Peter 2.	AS newborn babes, alleluia * desire the sincere milk of the word, alleluia, alleluia, alleluia.	Psalm 81. Sing we merrily unto God our strength * make a cheerful noise unto the God of Jacob. ✠Glory be &c	ALMIGHTY Father, who hast given thine only Son to die for our sins, and to rise again for our justification: grant us so to put away the leaven of malice and wickedness; that we may always serve thee in pureness of living and truth; through the merits of the same Jesus Christ thy Son our Lord, who liveth and reigneth with thee, in the unity of the Holy Spirit, ever one God, world without end. * Amen.	St John 20.	Alleluia. After eight days, the door being shut, Jesus stood in the midst of his disciples and said * Peace be unto you. Alleluia.	St Matthew 28. The Angel of the Lord descended from heaven, and said unto the women * He whom ye seek is risen, as he said. Alleluia.	WE beseech thee, O Lord, mercifully to accept the prayers and oblations ACCEPT, O Lord, we pray thee, the gifts which in her gladness the Church doth offer unto thee: that they on whom thou hast bestowed the cause of so great a gladness may thereby be profited unto everlasting felicity.  Through &c		St John 20.	Reach hither thy hand, and behold the print of the nails, alleluia * and be not faithless but believing, alleluia, alleluia.	GRANT, we beseech thee, O Lord our God: that these holy mysteries which thou hast given unto us for the assurance of our salvation, may both in this life and that which is to come be profitable unto us for the healing of our souls. Through &c.		30
Easter III	Jubilate Deo. Psalm  66.	O BE joyful in God, all ye lands, alleluia: sing praises unto the honour of his Name, alleluia * make his praise to be glorious, alleluia, alleluia, alleluia.	Psalm ibid. Say unto God, O how wonderful art thou in thy works, O Lord * through the greatness of thy power shall thine enemies be found liars unto thee. ✠Glory be &c	ALMIGHTY God, who hast given thine only Son to be unto us both a sacrifice for sin, and also an example of godly life: give us grace that we may always most thankfully receive his inestimable benefit; and also daily endeavour ourselves to follow the blessed steps of his most holy life; through the same Jesus Christ thy Son our Lord, who liveth and reigneth with thee, in the unity of the Holy Spirit, ever one God, world without end. * Amen.	St Luke 24.	Alleluia. Ought not Christ to have suffered these things: and to enter into his glory? Alleluia.	Psalm 146. Praise the Lord, O my soul: while I live will I praise the Lord * yea, as long as I have any being, I will sing praises unto my God, alleluia.	O LORD, we pray thee, that from these mysteries we may obtain such succour of thy grace, that refraining ourselves from the desire of all things earthly, we may learn to love all such things as are heavenly.  Through &c		St John 16.	A little while, and ye shall not see me, alleluia * and again a little while, and you shall see me, because I go to the Father, alleluia, alleluia.	O LORD our God, who hast made us partakers of this holy Sacrament: grant, we beseech thee; that we may be thereby inwardly satisfied with heavenly food, and outwardly defended against all adversities. Through &c.		32
Easter IV	Cantate Domino. Psalm  98.	O SING unto the Lord a new song, alleluia: for the Lord hath done marvellous things, alleluia * his righteousness hath he openly shewed in the sight of the heathen, alleluia, alleluia, alleluia.	Psalm ibid. With his own right hand and with his holy arm * hath he gotten himself the victory. ✠Glory be &c	ALMIGHTY God, who showest to them that be in error the light of thy truth, to the intent that they may return into the way of righteousness: grant unto all them that are admitted into the fellowship of Christ’s religion; that they may forsake those things that are contrary to their profession, and follow all such things as are agreeable to the same; through the same Jesus Christ thy Son our Lord, who liveth and reigneth with thee, in the unity of the Holy Spirit, ever one God, world without end. * Amen.	Romans 6.	Alleluia. Christ being raised from the dead dieth no more * death hath no more dominion over him. Alleluia.	Psalm 66. O be joyful in God, all ye lands, sing praises unto the honour of his Name * O come hither, and hearken, all ye that fear God, and I will tell you what the Lord hath done for my soul. Alleluia.	O GOD, who by the wondrous operation of this sacrifice, hast made us partakers of thy glorious Godhead: grant, we beseech thee, that we which are taught the knowledge of thy truth, may in all our conversation walk worthily of the same.  Through &c		St John 16.	When the Comforter, the Spirit of Truth, is come * he will reprove the world of sin, and of righteousness, and of judgement, alleluia, alleluia.	ASSIST us mercifully, O Lord our God: that we, which have in faithfulness received this holy Sacrament, may thereby be cleansed from all our iniquities, and delivered from all dangers that beset us. Through &c __________________________________________________________________		33
Easter V	Vocem jucunditatis. Isaiah 48.	WITH a voice of singing declare ye, tell this, alleluia: utter it even to the end of the earth * say ye, the Lord hath redeemed his people, alleluia, alleluia.	Psalm 66. O be joyful in God, all ye lands, sing praises unto the honour of his Name * make his praise to be glorious. ✠Glory be &c	O ALMIGHTY God, who alone makest the minds of the faithful to be of one will: grant unto thy people, that they may love the thing which thou commandest, and desire that which thou dost promise; that so, among the sundry and manifold changes of the world, our hearts may surely there be fixed, where true joys are to be found; through Jesus Christ thy Son our Lord, who liveth and reigneth with thee, in the unity of the Holy Spirit, ever one God, world without end. * Amen.	St John 16.	Alleluia. I came forth from the Father, and am come into the world * again, I leave the world, and go to the Father. Alleluia.	Psalm 66. O PRAISE our God, ye people, and make the voice of his praise to be heard: who holdeth our soul in life, and suffereth not our feet to slip * praised be God, who hath not cast out my prayer, nor turned his mercy from me, alleluia.	WE BESEECH thee, O Lord, to accept the prayers and oblations of thy faithful people: that through this observance of our bounden devotion we may attain to the glory of thy heavenly kingdom.  Through &c		Psalm 96.	O SING unto the Lord, alleluia * sing unto the Lord, and praise his Name, be telling of his salvation from day to day. alleluia, alleluia.	GRANT, we beseech thee, O Lord: that we, whom thou hast fulfilled with the bounty of thy heavenly banquet, may evermore desire those things that are according to thy will, and effectually obtain all things that we desire. Through &c		34
